ID,Posted at,Screen name,Text
414818254880661504,2013-12-22 18:02:33 +0000,ConanOBrien,"My son loves LEGOs, so for Christmas I got him the Goodfellas playset. Paul Sorvino is over 300 pieces."
414620184775639041,2013-12-22 04:55:29 +0000,ConanOBrien,Yet another Christmas without a special Flavor Flav box set.
414149717203775488,2013-12-20 21:46:01 +0000,ConanOBrien,What the song doesn’t mention is that Santa checks EVERYTHING twice. He has OCD.
413850369601454080,2013-12-20 01:56:31 +0000,ConanOBrien,I’ve been banned from the American Girl Store. Here’s why: http://t.co/XGVnNAe1OO
413459998388142080,2013-12-19 00:05:19 +0000,ConanOBrien,Gift cards: the best way to say “Here. You figure it out.”
413213652590682112,2013-12-18 07:46:26 +0000,ConanOBrien,I have the scoop of the century: @TomHanks reveals his acting technique from “Bosom Buddies.” http://t.co/wxoUrY0DDF
412732499265990656,2013-12-16 23:54:30 +0000,ConanOBrien,Presidential Pez dispensers! http://t.co/YdpaCfaCHZ
412387606924513280,2013-12-16 01:04:01 +0000,ConanOBrien,I still remember the first Christmas present my parents ever gave me. It was an iPad. Last year.
412081206637764608,2013-12-15 04:46:30 +0000,ConanOBrien,Photo Christmas cards: making husbands ask “Who are these people again?” since they were invented.
411616316332589056,2013-12-13 21:59:11 +0000,ConanOBrien,"This Christmas, I am giving everyone on my staff three seconds of eye contact."
411280510405464065,2013-12-12 23:44:49 +0000,ConanOBrien,Who says LA doesn't understand the real meaning of Christmas? http://t.co/f4wHsYOUnr
410945778186588160,2013-12-12 01:34:43 +0000,ConanOBrien,".@IceCube, @KevinHart4Real & I made a random @Lyft driver take us on a Hollywood adventure. #RideAlong or die, bitch! http://t.co/xQNcwVgelr"
410908136921243648,2013-12-11 23:05:08 +0000,ConanOBrien,"Tonight, I got to live out a dream: Showing Benedict Cumberbatch my cosplay for HolmesCon 2013! http://t.co/QUjranHc4t"
410638823513538560,2013-12-11 05:14:59 +0000,ConanOBrien,"I’m always happy whenever I hear an @ArcadeFire song, because I know some artisanal cheese can’t be far away."
410109492655706112,2013-12-09 18:11:37 +0000,ConanOBrien,"I’m almost done with my Christmas shopping. Thanks, Burger King!"
409894604389900288,2013-12-09 03:57:43 +0000,ConanOBrien,Phil Collins is making music again. It took him this long to decide which super close-up photo of his face to put on the album cover.
409446176551747584,2013-12-07 22:15:50 +0000,ConanOBrien,"Sunday, maybe the New York Jets don’t actually try to beat their opponent through football, but instead through a strongly-worded letter."
409050744247971840,2013-12-06 20:04:31 +0000,ConanOBrien,"Jim Parsons & I tore the clothes off @SimonHelberg on #CONAN last night. It was like Magic Mike, but with nerds. http://t.co/kcomftDd8m"
408661365641859072,2013-12-05 18:17:16 +0000,ConanOBrien,I am a better actor than Daniel Day-Lewis. Here's proof: http://t.co/4mznqH3p7h #SuckItDayLewis
408301513178488832,2013-12-04 18:27:21 +0000,ConanOBrien,"I don't want to say http://t.co/MkqSJ1u6kr is still flawed, but my health insurance is now being paid for by a prince in Nigeria."
408017632361590785,2013-12-03 23:39:18 +0000,ConanOBrien,"David Beckham said he was hazed his 1st year as a pro player. For 10 grueling minutes, he was forced to pose for photos with a shirt on."
407749271874576384,2013-12-03 05:52:56 +0000,ConanOBrien,"Amazon drone, wow. Just when I was getting used to the Barnes & Noble surface-to-air book launcher."
407386918616170496,2013-12-02 05:53:04 +0000,ConanOBrien,#OldSchoolTweet http://t.co/n0cDKkXevw
406846885651947520,2013-11-30 18:07:11 +0000,ConanOBrien,"You COULD let your guests pile their coats on the bed, but you're just inviting DNA confusion if the night ends in murder."
406598776321630208,2013-11-30 01:41:17 +0000,ConanOBrien,Not sure how to feel about this. My daughter's class just put on a pageant about The First Black Friday.
406520340127309824,2013-11-29 20:29:36 +0000,ConanOBrien,Should I be worried that I look a lot like the woman in this dry cleaning ad? http://t.co/QuIl4w7PHO
406169633331220480,2013-11-28 21:16:01 +0000,ConanOBrien,"In honor of Hanukkah falling on Thanksgiving, I am going to spend dinner feeling guilty about everything I have to be thankful for."
405768236160909312,2013-11-27 18:41:00 +0000,ConanOBrien,"Fortunately, ""gobble gobble"" is turkey for ""I'm ready, Jesus."""
405404809567563776,2013-11-26 18:36:53 +0000,ConanOBrien,I consider myself a moral person. That's why I only eat turkeys that have exhausted the appeals process.
405052015056674816,2013-11-25 19:15:00 +0000,ConanOBrien,"Fun fact: the 1st Thanksgiving had lobster, venison and small pox."
404776893712318464,2013-11-25 01:01:46 +0000,ConanOBrien,"Today is a day for drinking beer, watching football, and pretending I don't want to kiss all the players."
404332860200341504,2013-11-23 19:37:20 +0000,ConanOBrien,"I wasn’t going to try Prilosec, but then I saw an online ad of theirs featuring Larry the Cable Guy."
404088936772812801,2013-11-23 03:28:04 +0000,ConanOBrien,"R2D2 has been confirmed for the next #StarWars film. After all these years, R1D1 still can't catch a break."
403673642002702337,2013-11-21 23:57:50 +0000,ConanOBrien,A new study has found that women would rather watch TV than have sex. Sort of good news/bad news thing for me.
403370138260365312,2013-11-21 03:51:49 +0000,ConanOBrien,"Tonight on #CONAN, Mr. @RonBurgundy sings a moving song to Toronto Mayor Rob Ford. http://t.co/fqdc7Ome6N"
403327143737704448,2013-11-21 01:00:59 +0000,ConanOBrien,Apparently this just happens to anyone who gets within ten feet of @RonBurgundy: http://t.co/dTkpSpMmno #CONAN
402914077199962112,2013-11-19 21:39:36 +0000,ConanOBrien,This Rob Ford guy is proof that you can get pretty far just on looks and charm.
402615033831518208,2013-11-19 01:51:18 +0000,ConanOBrien,This insane supercut is both a recap of #CONAN season 3 and a recurring nightmare I've been having lately: http://t.co/StisATwvgz
402177386520653824,2013-11-17 20:52:15 +0000,ConanOBrien,"I'm gonna go jump in that big pile of leaves. Wait, that's Larry King sitting on his lawn."
401550874008223744,2013-11-16 03:22:43 +0000,ConanOBrien,"Starting a Twitter feud with @Pontifex.  Hey, Pope Francis!  I admire and respect you!  (Not good at Twitter feuds.)"
401084598383177728,2013-11-14 20:29:54 +0000,ConanOBrien,"The ""50 Shades of Grey"" movie will be postponed until 2015. For ""50 Shades"" fans, that's agony - sweet, sweet agony."
400818050145873920,2013-11-14 02:50:44 +0000,ConanOBrien,"Bill Clinton said in terms of Americans keeping their health policy, President Obama should ""keep his vow."" Then he laughed for 9 hours."
400459411480510464,2013-11-13 03:05:38 +0000,ConanOBrien,"To commemorate the 150th anniversary of The Gettysburg Address, I joined @KenBurns & #TheAddressPBS in reciting it: http://t.co/XhJWMSu3Te"
400360089665552384,2013-11-12 20:30:58 +0000,ConanOBrien,Text REDCROSS to 90999 to make a $10 donation to help #Haiyan victims. Give more here: http://t.co/ylA5iQFCjO.
399784007866400768,2013-11-11 06:21:49 +0000,ConanOBrien,Blockbuster announced they’re closing all their stores. Now where am I supposed to go when I want to be alone?
399384312069369857,2013-11-10 03:53:34 +0000,ConanOBrien,I was surprised to find out most of the new THOR movie takes place in a Vermont bed and breakfast.
398704427785129984,2013-11-08 06:51:57 +0000,ConanOBrien,"Enjoy the Twitter IPO, nerds. I'll be at the Myspace yardsale."
398266456497848320,2013-11-07 01:51:37 +0000,ConanOBrien,Is it wrong to drive out to a farm 3 weeks early just to taunt your Thanksgiving turkey?
397825410844475392,2013-11-05 20:39:03 +0000,ConanOBrien,.@ChrisRock & I are on @BETRealHusbands tonight. I'm gonna hit that network like a ton of plain yogurt. http://t.co/VNbsJICGF8
397444548135096320,2013-11-04 19:25:39 +0000,ConanOBrien,"Now that that the FAA is letting us be on our phones during take-off, I don’t want to use my phone during take-off."
397196327135617024,2013-11-04 02:59:18 +0000,ConanOBrien,A friend's 4 year old did this to me. I thought it was cute until I was shot at by the @Pokemon gang. http://t.co/qdPpJnnhac
396696095012577280,2013-11-02 17:51:33 +0000,ConanOBrien,"When my grandchildren ask me who I was and what I stood for, I’ll say these 3 words:""Money Shot Lincoln."" http://t.co/xBciHCedgk #Conan20"
396381298983325696,2013-11-01 21:00:40 +0000,ConanOBrien,"Check out 20 years of classic bits on TeamCoco: http://t.co/woRCHLOtez. They are “Safe For Work”, depending on how hot I make you. #Conan20"
396131830333579264,2013-11-01 04:29:22 +0000,ConanOBrien, I don’t like to be wasteful so I’m turning all my leftover Halloween candy corn into a chowder.
395799047673364480,2013-10-31 06:27:01 +0000,ConanOBrien,Celebrating 20 years on television. That’s over two decades of old people not understanding my show: http://t.co/woRCHLOtez #Conan20
395274285918330880,2013-10-29 19:41:48 +0000,ConanOBrien,"Watch #CONAN20 this week to see clips from my 20 years on TV, & see if you can pinpoint when my “procedure” was done. http://t.co/woRCHLOtez"
395053862345646081,2013-10-29 05:05:55 +0000,ConanOBrien,"For a safe and legal hallucinatory flashback, check out these clips from 20 years of hosting: http://t.co/woRCHLOtez #Conan20"
394686827946205184,2013-10-28 04:47:27 +0000,ConanOBrien,I Google-Imaged “Talkshow host.” http://t.co/HdogeN0IrW
394308198720491523,2013-10-27 03:42:55 +0000,ConanOBrien,I wonder if a shipment of cumberbunds is called a Cumberbatch.
393828663117893632,2013-10-25 19:57:24 +0000,ConanOBrien,Calling the horse races at Santa Anita today. It's going gangbusters! http://t.co/GqDBDK3Iu7
393552619253149697,2013-10-25 01:40:30 +0000,ConanOBrien,Who needs a star on the Hollywood Walk of Fame when I have this outside @FordsTheatre? http://t.co/A21YAe9Jsg
393189896627568640,2013-10-24 01:39:11 +0000,ConanOBrien,"I thought I’d seen it all, California. Wow. Gluten-free urinal cakes?"
392832776640012288,2013-10-23 02:00:07 +0000,ConanOBrien,"Too late, @BillGates - I’ve already paired up with the Winklevoss Twins & Tom from MySpace. We can’t lose!"
392456864765464576,2013-10-22 01:06:22 +0000,ConanOBrien,"Recently finished my 3,000th hour on TV. Only 7,000 more ‘til Malcolm @Gladwell thinks I’m an expert."
392105626035187712,2013-10-21 01:50:40 +0000,ConanOBrien,"Brazil is exhuming the bodies of two former presidents. Man, how bad is Brazil’s current president doing?"
391712138625945600,2013-10-19 23:47:06 +0000,ConanOBrien,PETA wants the Redskins to be named after a potato. Which is my family’s solution to everything.
391299197787328512,2013-10-18 20:26:13 +0000,ConanOBrien,Just got nominated for my first Daytime Pulitzer.
390909490947563520,2013-10-17 18:37:40 +0000,ConanOBrien,I hate to be a hypochondriac but do these pox look small to you?
390646931350777856,2013-10-17 01:14:20 +0000,ConanOBrien,RT if you're going to watch #SuperFunNight tonight AND you enjoy retweeting random tweets.
390283612450332672,2013-10-16 01:10:38 +0000,ConanOBrien,The folks at @Pillsbury are getting aggressive: http://t.co/HISdE7ZaYS
389969893442846721,2013-10-15 04:24:02 +0000,ConanOBrien,Anyone else watch “Jeopardy” shirtless with face paint?
389474940279218176,2013-10-13 19:37:16 +0000,ConanOBrien,Congratulations L.M.F.A.O. for cleaning up at the Acronymies.
389152485140492288,2013-10-12 22:15:57 +0000,ConanOBrien,"Party going on too long? Go up to your guests and whisper, “I hope you’ll stay for my dream journal reading.”"
388888963563270144,2013-10-12 04:48:48 +0000,ConanOBrien,I just got kicked out of the Museum of Tolerance.
388375216864260096,2013-10-10 18:47:22 +0000,ConanOBrien,Wife not buying that government shutdown includes all gyms.
388021101155995648,2013-10-09 19:20:14 +0000,ConanOBrien,Make room on your DVRs for tonight's new episode of #SuperFunNight. I know you can part with ONE of those serial killer documentaries.
387684305687699457,2013-10-08 21:01:55 +0000,ConanOBrien,The Gerald Ford Presidential Museum is closed due to the shutdown. Where’s my daughter supposed to celebrate her 10th birthday now?
387356803618439171,2013-10-07 23:20:33 +0000,ConanOBrien,Just saw Gravity in 3D. Can’t believe all that happened because someone downloaded iO7 on an iPhone 4.
386894393057107968,2013-10-06 16:43:06 +0000,ConanOBrien,Crazy week - turns out my Dad might be Woody Allen.
386595977643061249,2013-10-05 20:57:18 +0000,ConanOBrien,"Over 9 million Twitter followers. 1 million more and the empty feeling goes away, right?"
386302536832921600,2013-10-05 01:31:16 +0000,ConanOBrien,"My rear end, in Latin, is “gluteus non-existentus.”"
385821222941908992,2013-10-03 17:38:42 +0000,ConanOBrien,Not gonna worry about the neighbor who’s marching around his back yard with a bridal veil on his rake.
385528264149585921,2013-10-02 22:14:35 +0000,ConanOBrien,".@RebelWilson's new show #SuperFunNight starts tonight. It's like #BreakingBad, but without all the meth and killing and starring 3 girls."
385222500239417345,2013-10-02 01:59:35 +0000,ConanOBrien,"Halloween is just a month away, and I still haven’t picked out my excuse for not dressing up."
384842421181239296,2013-10-01 00:49:17 +0000,ConanOBrien,"Obamacare begins tomorrow, and you know what that means! Wait, actually, no, you probably don't know what that means."
384505259952861184,2013-09-30 02:29:32 +0000,ConanOBrien,Anyone else thought of chaining Vince Gilligan in a barn to make him come up with another show?
384033598233247744,2013-09-28 19:15:19 +0000,ConanOBrien,"A Vatican Cardinal is claiming Jesus was the first Tweeter. Also, the Shroud of Turin was the first “selfie.”"
383778984669892610,2013-09-28 02:23:34 +0000,ConanOBrien,Why can’t they make meth with fluoride?
383734967244570625,2013-09-27 23:28:40 +0000,ConanOBrien,"I just used the phrase “throw shade,” so that’s over."
383304187204747264,2013-09-26 18:56:54 +0000,ConanOBrien,"Still early in the season, but I’m pretty sure my fantasy football team is headed to the Lingerie Bowl."
382984510062596096,2013-09-25 21:46:37 +0000,ConanOBrien,"The guys from It's @AlwaysSunny are on #CONAN tonight, and I finally learn what it's like to change another man's tighty whities."
382588281654743040,2013-09-24 19:32:09 +0000,ConanOBrien,Can't believe Bryan Cranston's fans send him erotic mail. My fans send me expired sunblock. http://t.co/5uQtn4O41v
382290250573164544,2013-09-23 23:47:53 +0000,ConanOBrien,"The cast of @BreakingBad_AMC is on tonight. I haven't been this excited since I reunited the original cast of ""Suite Life of Zack & Cody""."
382208458180657152,2013-09-23 18:22:52 +0000,ConanOBrien,I have the entire cast of @BreakingBad_AMC on #CONAN tonight. Many secrets will be revealed. Miss it and you're a fool.
381925321752055808,2013-09-22 23:37:47 +0000,ConanOBrien,A guy backstage at the #Emmys just told me where they get the gold statues. Fracking. The soil of Western PA is lousy with 'em.
381600490829533184,2013-09-22 02:07:01 +0000,ConanOBrien,iOS7? More like iOSHeaven. #ApplePleaseSendMeAniPad
381190461303422976,2013-09-20 22:57:42 +0000,ConanOBrien,Last night I played #GTAV and showed the world what a badass I really am. Now I can't get car insurance. http://t.co/RV8E00HErJ
380875665513250816,2013-09-20 02:06:49 +0000,ConanOBrien,Did an entire show with @LouisCK tonight. It was really special. #GenuinelyNiceTweet
380545724045201408,2013-09-19 04:15:45 +0000,ConanOBrien,"The new Grand Theft Auto has already made 800 million dollars? Starting tomorrow, I start murdering my guests."
380162301199777792,2013-09-18 02:52:10 +0000,ConanOBrien,Getting so tired of strangers on the street hugging me and calling me Arsenio.
379754063081897986,2013-09-16 23:49:58 +0000,ConanOBrien,"Here in L.A., it’s hotter than something that’s extremely warm. #TooHotForAnalogies"
379297089097707520,2013-09-15 17:34:07 +0000,ConanOBrien,"I’m torn because I love the new iPhone5S’s fingerprint scanner, but I also want to get away with some murders."
378998345160609792,2013-09-14 21:47:01 +0000,ConanOBrien,"Today is Yom Kippur, the Jewish Day of Atonement, the day when Jews around the world ask for forgiveness for Anthony Weiner."
378652479035961344,2013-09-13 22:52:40 +0000,ConanOBrien,"20 years ago today I made my TV debut. I offered the tapes to The Smithsonian, and they said to leave them out by the recycling bins."
378581772084051970,2013-09-13 18:11:42 +0000,ConanOBrien,"What do you tip a masseuse who constantly mutters, “I always get the bony ones”?"
378200790566850560,2013-09-12 16:57:49 +0000,ConanOBrien,Just found out Spain has its own version of SNL. It’s just 90 minutes of ham tastings.
377838322673909760,2013-09-11 16:57:30 +0000,ConanOBrien,I love when my kids bring me breakfast in bed while dressed as the little girls in “The Shining”.
377572366005448704,2013-09-10 23:20:41 +0000,ConanOBrien,"Trust me, when I say, “Jump!”, my employees say, “That’s a good Van Halen song.”"
377290173056155648,2013-09-10 04:39:21 +0000,ConanOBrien,Scientists have discovered a new shark species that can walk. It was immediately hired by CAA.
376918370756468736,2013-09-09 04:01:57 +0000,ConanOBrien,The new “Madden NFL 25” lets you control a player's career over several seasons. I got it just so I could keep repeatedly firing Tim Tebow.
376390424098648064,2013-09-07 17:04:04 +0000,ConanOBrien,".@OperaMemphis wants @CarlReiner to perform Die Fledermaus after performing on my show. Internet, Let's do this! http://t.co/l2NSyOeOrv"
376142563276640256,2013-09-07 00:39:10 +0000,ConanOBrien,Watched the Bronco game last night. Nice to finally see NFL guys wearing orange that aren’t jumpsuits.
375812279368835072,2013-09-06 02:46:44 +0000,ConanOBrien,.@Snooki is going to be on the new season of Dancing With The Stars. Question: Can Time Warner get into a fight with ABC this Fall?
375337437003669505,2013-09-04 19:19:53 +0000,ConanOBrien,"""Orange is The New Black"" is proof that I wouldn't survive five minutes in a minimum security women's correctional facility."
375113833288695808,2013-09-04 04:31:21 +0000,ConanOBrien,I dread the inevitable video where old people are twerking. You know it's coming.
374640749431648256,2013-09-02 21:11:29 +0000,ConanOBrien,Talked to the guy in charge of milk expiration dates. He said he just uses relatives’ birthdays.
374394562690555906,2013-09-02 04:53:14 +0000,ConanOBrien,Happy birthday to Turkish footballer Hakan Şükür! #didntevenneedwikipedia
373896435139231744,2013-08-31 19:53:51 +0000,ConanOBrien,"Hey, small child in China in charge of my Twitter account, don’t tweet this yet."
373526730025091072,2013-08-30 19:24:46 +0000,ConanOBrien,Finally reached “Premier Elite Executive Diamond Platinum My Life Is Empty” status on American Airlines.
373188384824381440,2013-08-29 21:00:19 +0000,ConanOBrien,"I don’t want to tell anyone how to run their company, but how come I can’t walk into a @Starbucks and order a venti Guinnessacino?"
372769837786730496,2013-08-28 17:17:09 +0000,ConanOBrien,"I’m at high risk of being victimized by revenge porn, just as soon as I can convince someone to shoot me doing porn."
372480557944283136,2013-08-27 22:07:40 +0000,ConanOBrien,"There’s misplaced cockiness, and then there’s this guy: http://t.co/PXqFsJP75T"
372148776405716992,2013-08-27 00:09:17 +0000,ConanOBrien,I understand Miley’s VMA performance. I’ve missed dozens of NFL games because my foam hand and I never made it out of the bedroom.
372080870556827649,2013-08-26 19:39:27 +0000,ConanOBrien,"On this day, The Seljuk Turks defeated the Byzantine Army at Manzikert. #didntevenneedwikipedia"
371742674769833985,2013-08-25 21:15:34 +0000,ConanOBrien,".@HuffingtonPost is set to ban anonymous comments. I guess ""SexxxyGingerNotConanOBrien"" will have to move on to greener pastures."
371402742176034816,2013-08-24 22:44:48 +0000,ConanOBrien,Ladies: Looking for a married man who’s totally committed to his wife & only allowed to talk to other women via tweets? I’m your man.
370951396067008512,2013-08-23 16:51:19 +0000,ConanOBrien,Remember: it’s never too late to become a child prodigy.
370671374450163712,2013-08-22 22:18:37 +0000,ConanOBrien,Want to meet the coolest waitress in the world?  Her name is Serena and she's at The Elysian Brewing Co on East Pike Street in Seattle.
370598606903840768,2013-08-22 17:29:27 +0000,ConanOBrien,"A new study says it costs $241,000 to raise a child to age 18. However, that's mostly due to the candy cigarette tax."
370368042049339392,2013-08-22 02:13:16 +0000,ConanOBrien,"Elon Musk's hyperloop is happening, and Marge can do nothing to stop it."
369937522417086464,2013-08-20 21:42:33 +0000,ConanOBrien,"Christian Bale has been offered $50 million to play Batman. Save your money, Hollywood, I’ll do it for $40 million!"
369595896163336192,2013-08-19 23:05:03 +0000,ConanOBrien,"Shout out to Gaius Julius Caesar Octavianus, who on this day in 43 B.C., compelled the Senate to elect him Consul. #didntevenneedwikipedia"
369205511607959552,2013-08-18 21:13:48 +0000,ConanOBrien,"Apparently, Mayor Filner sexually harassed a great-grandmother. Today, Filner said, ""You can call me sexist, but you can't call me ageist."""
368909436032532480,2013-08-18 01:37:18 +0000,ConanOBrien,"Ha ha, this doorstop is shaped like a Blackberry."
368538921996533760,2013-08-17 01:05:00 +0000,ConanOBrien,Building a Hyper Loop to get me out of this family reunion.
368110073882497024,2013-08-15 20:40:55 +0000,ConanOBrien,"No matter how many Back to School sales I scope out, I can’t seem to find one decent “Breaking Bad” lunch box."
367844194905120768,2013-08-15 03:04:24 +0000,ConanOBrien,"This week, John McCain was called in for jury duty. McCain hasn’t served on a jury since the landmark case of “Man v. Fire.”"
367391315132022784,2013-08-13 21:04:49 +0000,ConanOBrien,Just bought Detroit on Etsy.
367121063974404096,2013-08-13 03:10:57 +0000,ConanOBrien,Justin Bieber was involved in another all-out brawl. This one with Brownie Troop #152.
366659299679809536,2013-08-11 20:36:03 +0000,ConanOBrien,"Netflix pulled a Star Trek film after complaints about incorrect Vulcan subtitles. Also, allegations of completely fake words like “vagina.”"
366412569029771264,2013-08-11 04:15:38 +0000,ConanOBrien,"Obama turned down a role in Oprah’s movie “The Butler.”  Instead, Oprah had to go with her second choice, German Chancellor Angela Merkel."
366031382654365696,2013-08-10 03:00:56 +0000,ConanOBrien,Does anyone know if those metal exoskeletons from “Elysium” are available at Sharper Image?
365603531526381568,2013-08-08 22:40:49 +0000,ConanOBrien,"Of all the thrills of my career, getting to style @Beyonce’s hair is way up there: http://t.co/dgXft2j32l"
365256996380884992,2013-08-07 23:43:48 +0000,ConanOBrien,"32 other countries have a greater life expectancy than the U.S.  This is due to obesity, smoking and the NFL."
364921211391709185,2013-08-07 01:29:31 +0000,ConanOBrien,Has anyone else noticed the Royal Baby still isn't speaking to the media?
364588934283542529,2013-08-06 03:29:10 +0000,ConanOBrien,"Confession time. Since 1997, I’ve been writing a children’s book series under the pseudonym “JK Rowling.”"
364196798539116544,2013-08-05 01:30:57 +0000,ConanOBrien,President Obama said he’s urging his daughters not to get caught up trying to act like celebrities. He’s particularly worried about Sa$ha.
363766870182068225,2013-08-03 21:02:34 +0000,ConanOBrien,"Not looking forward to the next Wolverine movie, where he fights his ultimate nemesis: “The Blackboard.”"
363514719342047233,2013-08-03 04:20:37 +0000,ConanOBrien,A new study finds coffee drinkers are 50% less likely to commit suicide. Just wait until the debut of Starbucks’ new “Sylvia Plathaccino.”
363052444990705666,2013-08-01 21:43:42 +0000,ConanOBrien,"This new Pope seems kind of cool, but I’ll reserve judgment until I see his set at Lollapalooza."
362669141720711169,2013-07-31 20:20:36 +0000,ConanOBrien,"Last weekend, a German woman gave birth to a 13.47 lb baby. Doctors say the mom is resting comfortably and the baby is invading Poland."
362293316517232641,2013-07-30 19:27:12 +0000,ConanOBrien,"The Army says it plans to start using lead-free, eco-friendly bullets. Also, unmanned drones will notify their presence with smooth jazz."
361977683464302592,2013-07-29 22:32:59 +0000,ConanOBrien,"I was surfing the internet yesterday, when I was struck with a horrible vision of our future: http://t.co/mhdze8EtGp"
361718424021372929,2013-07-29 05:22:47 +0000,ConanOBrien,The United States…….. is………ranked………….9th ………in the……….world for…………………… Internet speed.
361341795042467840,2013-07-28 04:26:12 +0000,ConanOBrien,"So, the CEO of Google has a $15 million sex penthouse? That’s nothing compared to my $20 a month sex P.O. Box."
360994752168075264,2013-07-27 05:27:10 +0000,ConanOBrien,Just saw Val Kilmer as Mark Twain at the Kirk Douglas Theatre. He is so funny and fantastic I am bitterly jealous.
360882758073057280,2013-07-26 22:02:09 +0000,ConanOBrien,"Anthony Weiner said, “More will come out.” Just how long is this guy’s penis?"
360470989752107008,2013-07-25 18:45:55 +0000,ConanOBrien,"Wow, Slayer’s “Raining Blood” sure sounds less sinister on a banjo."
360230362028314627,2013-07-25 02:49:45 +0000,ConanOBrien,Help kill the television industry - subscribe to my Youtube channel today! http://t.co/DGdn2nOf5p
359845395096014848,2013-07-24 01:20:02 +0000,ConanOBrien,"Just got out of a traffic ticket with tickets to the show. Luckily, that cop loves “Ellen”."
