ID,Posted at,Screen name,Text
468617828740767745,2014-05-20 05:02:51 +0000,ConanOBrien,The next Jurassic Park movie should take place on an island where they’ve revived a working Blockbuster Video.
468061756854898689,2014-05-18 16:13:13 +0000,ConanOBrien,Overheard Tom Brady brag that he just had a Brazilian who'd just had a Brazilian.
467413618191917057,2014-05-16 21:17:45 +0000,ConanOBrien,My Starbucks name is dirtier than my porn name.
467132353219805184,2014-05-16 02:40:06 +0000,ConanOBrien,"Just saw @JamesFrancoTV and Chris O'Dowd kill it in ""Of Mice and Men."" I'm on the left: http://t.co/OZuT6Wsrvd"
466637748166602752,2014-05-14 17:54:43 +0000,ConanOBrien,I’m being blackmailed by my mistress. She’s threatening to tell everyone we only get together to play Jenga.
466291369296687104,2014-05-13 18:58:20 +0000,ConanOBrien,"I believe it was Horace Greeley who once said, “Never quote an obscure historical figure in a tweet.”"
465918969195421696,2014-05-12 18:18:33 +0000,ConanOBrien,"My cousin asked me to Tweet about his Hootie and the Blowfish tribute band. Blowie and the Hootfish. I said no, of course."
465576553330790400,2014-05-11 19:37:54 +0000,ConanOBrien,For Mother’s Day I’m giving my wife the one thing she wants from me: space.
465264616751108096,2014-05-10 22:58:23 +0000,ConanOBrien,"Several of the women on my staff call me ""Creeper."" This is a Minecraft thing, right?"
464817464359272448,2014-05-09 17:21:34 +0000,ConanOBrien,Most people don’t know that the “S” in Harry S. Truman stood for “Sharktopus.”
464494943265128449,2014-05-08 19:59:59 +0000,ConanOBrien,Happy Teacher Apprecciatiuon Week.
464285745398943744,2014-05-08 06:08:42 +0000,ConanOBrien,Performed tonight for President @BarackObama on behalf of an amazing organization: http://t.co/IkugWVHVxI
463898726172336128,2014-05-07 04:30:49 +0000,ConanOBrien,"I generally don’t condone grave robbing, but sometimes a guy just needs a new pair of shoes."
463429433743777792,2014-05-05 21:26:01 +0000,ConanOBrien,"Happy Cinco de Mayo! If your Mariachi band didn’t book a gig today, you may want to explore new management."
463176415089668096,2014-05-05 04:40:37 +0000,ConanOBrien,"Happy Cinco de Mayo everybody! I know it’s a day early, but typing requires fine motor skills I won’t have tomorrow."
462695121104826368,2014-05-03 20:48:07 +0000,ConanOBrien,"I was just informed that I no longer need to yell ""SPOILER ALERT"" when describing old ""Columbo"" episodes."
462460826784251904,2014-05-03 05:17:07 +0000,ConanOBrien,April showers bring May flowers and Mayflowers bring small pox.
462068113320574976,2014-05-02 03:16:37 +0000,ConanOBrien,Rob Ford has to stop hanging around crack-activated cameras.
461579660220833792,2014-04-30 18:55:41 +0000,ConanOBrien,"My daughter is afraid Mickey Rourke is hiding under her bed. I guess it’s possible. Going to check. Yup, he’s there."
461322525809446912,2014-04-30 01:53:55 +0000,ConanOBrien,Just saw a guy driving a Tesla while wearing Google Glass and blaring Daft Punk. Now THAT’S how you overcompensate.
460838316598767617,2014-04-28 17:49:51 +0000,ConanOBrien,"I know it's early in the season, but so far my Game of Thrones ""murder bracket"" is intact."
460532766036074496,2014-04-27 21:35:42 +0000,ConanOBrien,I'm frequently told that I resemble someone's best friend who still likes ska.
460251169374232577,2014-04-27 02:56:44 +0000,ConanOBrien,You have to get up pretty early in the morning to catch me using a cliche.
459853103651885056,2014-04-26 00:34:58 +0000,ConanOBrien,"I may be off the air on TV this week, but check out my work on the CB radio band as ""Gingey, the Truckstop Whore."""
459547627986493440,2014-04-25 04:21:07 +0000,ConanOBrien,"Just benched 300 (sat on a bench, watched ""300""). "
459024247180886016,2014-04-23 17:41:23 +0000,ConanOBrien,"Saturn just gave birth to a moon. I'm pretty sure she¹s not a single parent, because she has a ring."
458774974031863809,2014-04-23 01:10:52 +0000,ConanOBrien,"Let¹s face it, anyone named Captain America should be overweight and have a porn addiction."
458320995250499585,2014-04-21 19:06:55 +0000,ConanOBrien,Camped out at CVS so I can beat the rush for half-priced Peeps.
458048640854929408,2014-04-21 01:04:40 +0000,ConanOBrien,On the Seattle ferry and Mark proposed to Jo right in front of me. The three of us will be so happy together! http://t.co/7T9TjH12gR
457957342357647362,2014-04-20 19:01:53 +0000,ConanOBrien,Who painted these Easter eggs? BANKSY!!!
457707578235969536,2014-04-20 02:29:25 +0000,ConanOBrien,"Babies are being named after ""Game of Thrones"" characters?  What parents would name a baby after a sword wielding, mythological character?"
457235034202595328,2014-04-18 19:11:41 +0000,ConanOBrien,I sense there is a plan to commemorate my birthday with an equestrian statue on the Washington Mall and I approve.
456937376896385024,2014-04-17 23:28:54 +0000,ConanOBrien,"Just found out that you can lead a horse to water, but you can't make him look at alarming statistics about beach erosion."
456489994689863681,2014-04-16 17:51:10 +0000,ConanOBrien,"Ah, springtime in LA, when the birds return for pilot season."
456152455634378752,2014-04-15 19:29:54 +0000,ConanOBrien,"Tonight I am X-CITED to have the X-CLUSIVE final trailer for ""#XMEN: Days of Future Past."" 11/10c. It's X-MAZING!"
455816471088619521,2014-04-14 21:14:50 +0000,ConanOBrien,I thought that hosting the MTV Movie Awards would guarantee they spell my name right on my security pass: http://t.co/Lw8UW7z0Ug
455547467803951104,2014-04-14 03:25:54 +0000,ConanOBrien,I had a blast hosting the @MTV #MovieAwards tonight. Thanks to the 49 friends who helped me out: http://t.co/lHrxDV9OnX
455537850272870400,2014-04-14 02:47:41 +0000,ConanOBrien,I've spent a good chunk of the @MTV #MovieAwards inside this flaming popcorn. I'm now 7% butter. http://t.co/uQwsuB16zf
455524202640977920,2014-04-14 01:53:27 +0000,ConanOBrien,"Tonight the stage is actually on fire at the @MTV #MovieAwards. FYI I'm cooking a lamb shank over the ""I"" in ""MOVIE."" http://t.co/MzGdxRW3pL"
455518495778689025,2014-04-14 01:30:47 +0000,ConanOBrien,"So much amazing art backstage at the @MTV #MovieAwards. For instance, here's a replica of Rodin's ""Pull My Finger."" http://t.co/J5UwkjKOpC"
455456506696048640,2014-04-13 21:24:28 +0000,ConanOBrien,"As host of the @MTV #MovieAwards tonight, I pledge to stay completely impartial. http://t.co/jjBQWsW46l"
455153690412732416,2014-04-13 01:21:11 +0000,ConanOBrien,My name is Conan and... I'm into Thor cosplay. @MTV #MovieAwards http://t.co/jVMCAOmdOo
454862230400421888,2014-04-12 06:03:01 +0000,ConanOBrien,Just finished watching the most emotionally powerful film of the year. #MovieAwards http://t.co/CESijgNFAs
454703312320077824,2014-04-11 19:31:32 +0000,ConanOBrien,I've taken over @MTV for 1 hr. Ask me anything NOW! Unless it has to do with British naval history; that's my blind spot. #AskConan
454483864778326017,2014-04-11 04:59:32 +0000,ConanOBrien,About to binge watch every @MTV #MovieAwards nominee in one sitting. Wish me luck! http://t.co/DyGkxUTKnN
454459235909132288,2014-04-11 03:21:39 +0000,ConanOBrien,Tomorrow I take over @MTV’s Twitter from 3:30-4:30ET. It’s the first step in my plan to get cast on @MTVTeenWolf. #MovieAwards.
454118301892116480,2014-04-10 04:46:54 +0000,ConanOBrien,Hey @MTV - these #MovieAwards screeners you sent don't work! http://t.co/H7FNXvRUww
453770472782446592,2014-04-09 05:44:46 +0000,ConanOBrien,Getting ready for the @MTV #MovieAwards with my all-time favorite movie snack. http://t.co/tpXEGzQ5hR
453399036821643265,2014-04-08 05:08:48 +0000,ConanOBrien,"Great acting in ""Noah.""  Giraffe #2 was incredible."
453027199570808832,2014-04-07 04:31:15 +0000,ConanOBrien,“Meredith Vieira covered in garlic aioli” is my most vowel-heavy sexual fantasy.
452639565413482496,2014-04-06 02:50:56 +0000,ConanOBrien,I just had an epic Italian meal in New York.  Go here ASAP.  http://t.co/cUOGM5WjnE
452298055123869696,2014-04-05 04:13:54 +0000,ConanOBrien,Texas: Thanks for a great week of shows and food. I haven't had that much meat inside of me since that one experimental night in college.
451881201905582081,2014-04-04 00:37:28 +0000,ConanOBrien,See Charles Barkley solve one of life's greatest mysteries: Which of us has the bigger head. http://t.co/Yv4VhlHffz #ConanDallas
451782703323418624,2014-04-03 18:06:04 +0000,ConanOBrien,"Tonight, on my final night in Texas, I'm bringing back one of my greatest inventions: http://t.co/hxNsOlQeZ6 #ConanDallas"
451544986597597184,2014-04-03 02:21:28 +0000,ConanOBrien,"Confession: I don't understand how photobombs work, @SimonHelberg. http://t.co/50EottOhU4 #ConanDallas"
451517791221215232,2014-04-03 00:33:24 +0000,ConanOBrien,"Tonight on #ConanDallas, @AndyRichter and I did this. If it's wrong, I don't want to be right: http://t.co/GvFeTxpRf5"
451148884618670081,2014-04-02 00:07:30 +0000,ConanOBrien,"Aw, @SethRogen brought me the traditional Texas gift, ""an aluminum tin of room-temperature beans."" http://t.co/VNrkYAEJuY #ConanDallas"
450788722552745984,2014-04-01 00:16:21 +0000,ConanOBrien,".@AdamSandler agreed to be on #ConanDallas tonight only if I let him give me a ""Texas Titty Twister"": http://t.co/OZGGrbGFpc"
450457803472117760,2014-03-31 02:21:24 +0000,ConanOBrien,"During #ConanDallas, we’re gonna rope a steer, shoot some tequila, then pick up a damned mean clutch purse at @NeimanMarcus."
450054237079101440,2014-03-29 23:37:46 +0000,ConanOBrien,"Everything’s bigger in Texas, so while I’m here I’m updating my dick pics."
449762914312798208,2014-03-29 04:20:09 +0000,ConanOBrien,It just struck me – Wolf Blitzer is just a serious-looking dandelion.
449285789860388864,2014-03-27 20:44:14 +0000,ConanOBrien,"Spring is officially here, so I can finally binge watch TV outside."
448930603509886976,2014-03-26 21:12:51 +0000,ConanOBrien,Quiznos filed for bankruptcy protection? So where are all the people who never ate there not going to eat?
448629542828007424,2014-03-26 01:16:32 +0000,ConanOBrien,I invited @IFCPortlandia's Fred and Carrie into my blanket fort before tonight's show: http://t.co/CWoNPLVwe4
448145721510748160,2014-03-24 17:14:00 +0000,ConanOBrien,I’m worried that “Captain America: The Winter Soldier” is just going to be 2 hours of him posting Polar Vortex photos on his Facebook page.
447841878193369088,2014-03-23 21:06:38 +0000,ConanOBrien,"To be fair, I'm pretty sure Crimeans probably can’t find Los Angeles on a map either."
447504433866235904,2014-03-22 22:45:45 +0000,ConanOBrien,We need to deal with Putin once and for all... Send over our sharpest improv team.
447078545731235840,2014-03-21 18:33:26 +0000,ConanOBrien,"I think what pushed Fred Phelps over the edge was the opening of ""300: Rise of an Empire."""
446839631351275520,2014-03-21 02:44:04 +0000,ConanOBrien,"Fun fact about me: when I panic, my voice pitches down to a smooth mellow baritone."
446463683536113665,2014-03-20 01:50:11 +0000,ConanOBrien,I’m lovin’ my new Treadmill Bed!
446125221473308672,2014-03-19 03:25:16 +0000,ConanOBrien,"Just Googled 47 products I would never buy, just to see how fast ads for them pop up on my Facebook page."
445558717497352194,2014-03-17 13:54:10 +0000,ConanOBrien,"Terrible climate, centuries of oppression, and the gene for alcoholism. Or as I call it, “The luck of the Irish.”"
445406428719628288,2014-03-17 03:49:02 +0000,ConanOBrien,"Everybody is Irish on St. Patrick’s Day, which must make it a living hell for Irish Immigration officials."
445244071280246786,2014-03-16 17:03:53 +0000,ConanOBrien,So sad to hear David Brenner passed. He was a frequent & always hilarious guest on my Late Night show. He will be missed.
444897200242319360,2014-03-15 18:05:32 +0000,ConanOBrien,Do you think Putin just misunderstood the term “March Madness”?
444634745188519936,2014-03-15 00:42:38 +0000,ConanOBrien,"An artist puking on @LadyGaga is national news, but no one cares that I drooled on @SofiaVergara?"
444552808642007040,2014-03-14 19:17:03 +0000,ConanOBrien,Wife really wants to see “300: Rise of an Empire.” Doesn’t she know those hunky actors are playing fast and loose with historical facts?
444163160660910083,2014-03-13 17:28:44 +0000,ConanOBrien,Taken right before @AaronPaul_8 taught me how to tie a tie: http://t.co/WxxTAPOJ5O
443807811609182209,2014-03-12 17:56:42 +0000,ConanOBrien,Forbes released the list of the richest billionaires. Kinda makes you feel bad for the poorest billionaires.
443537912563392514,2014-03-12 00:04:13 +0000,ConanOBrien,Massachusetts just banned upskirting. So I guess I won’t be coming home for Easter after all.
443229335797780480,2014-03-11 03:38:03 +0000,ConanOBrien,"I want to make sure I win if I'm ever on ""Celebrity Jeopardy."" http://t.co/T7x6IrzB7K"
443096915538739200,2014-03-10 18:51:51 +0000,ConanOBrien,"Sunday was Daylight Savings Time, so I gained an hour of sunscreen."
442723417846870016,2014-03-09 18:07:42 +0000,ConanOBrien,"Driving near Fort Worth, Texas. Best slogan ever for a restaurant: http://t.co/N71bM13BVY"
442312164515119104,2014-03-08 14:53:32 +0000,ConanOBrien,I would love to write “As Seen On PBS’s Antiques Roadshow” next to this convenience store hot dog.
441756043211571201,2014-03-07 02:03:42 +0000,ConanOBrien,"My son asked me what happens when you die, and I said, “I’m watching Chopped, just google it.”"
441226715923111937,2014-03-05 15:00:21 +0000,ConanOBrien,"I'm excited to host the MTV #MovieAwards on 4/13! I was going to say no, but @Harry_Styles begged me. Please don't ask him to confirm this."
441045767751335937,2014-03-05 03:01:19 +0000,ConanOBrien,Pope Francis's humility reminds me so much of my own.
440700263364456448,2014-03-04 04:08:25 +0000,ConanOBrien,I just found out my autocorrect has been programmed by John Travolta.
440287734444212224,2014-03-03 00:49:10 +0000,ConanOBrien,I’d like to think I’m the Meryl Streep of spilling dip at Oscar parties. #Oscars2014
439849615425155072,2014-03-01 19:48:14 +0000,ConanOBrien,"My guests next week are James Spader, Bill Hader, Ralph Nader, and Darth Vader."
439490305558343681,2014-02-28 20:00:28 +0000,ConanOBrien,Please watch the first-ever @WhiteHouse Student Film Fest @ 3:30 ET: http://t.co/pzz6rtlbRW. I don't need another audit. #WHFilmFest
439459277506244608,2014-02-28 17:57:11 +0000,ConanOBrien,Just took the kids to see Philomena in 3D.
439134535146430464,2014-02-27 20:26:46 +0000,ConanOBrien,I can’t drink Muscle Milk anymore because I discovered my body is muscle intolerant.
438742397011238912,2014-02-26 18:28:33 +0000,ConanOBrien,We’re going to Dallas in late March. I’ll show those women what big hair is all about.
438587737151508480,2014-02-26 08:13:59 +0000,ConanOBrien,I find all my best babysitters on Tinder.
438055443630276608,2014-02-24 20:58:51 +0000,ConanOBrien,"Just once in my life, I’d like to know the sweet satisfaction of finishing a tube of ChapStick."
437719435940360192,2014-02-23 22:43:40 +0000,ConanOBrien,"Whenever my children call me ""Father,"" I feel like I'm about to be murdered, in black and white."
437381741406220288,2014-02-23 00:21:47 +0000,ConanOBrien,Just took one of those “Which Movie Character Are You?” quizzes and found out I’m the plastic bag from American Beauty.
436931188398100480,2014-02-21 18:31:27 +0000,ConanOBrien,How much does Ira Glass charge to narrate a sex tape?
436641583434174464,2014-02-20 23:20:40 +0000,ConanOBrien,"A new study shows on average, men’s brains are larger than women’s. But the extra space is filled entirely with barbecue sauce."
436247213027504128,2014-02-19 21:13:35 +0000,ConanOBrien,"Watching that new Irish hoarding show, where they clean out a man’s lifetime accumulation of slights, rebuffs and resentments."
435949565615669249,2014-02-19 01:30:50 +0000,ConanOBrien,"Tonight I fanboy out with @MelBrooks about one of my comedy heroes, Sid Caesar. Also, I make an apology for using the phrase ""fanboy out."""
435510691177308160,2014-02-17 20:26:54 +0000,ConanOBrien,".@sethmeyers That's not a janitor's closet, that was my dressing room."
435436027914633219,2014-02-17 15:30:13 +0000,ConanOBrien,"As the only man alive who’s hosted The Tonight Show & Late Night, I want to congratulate @JimmyFallon & @SethMeyers. They’ll both do great!"
435273030927802368,2014-02-17 04:42:32 +0000,ConanOBrien,Wow. Strippers get angry if you make it rain Bitcoins.
434880732318560257,2014-02-16 02:43:40 +0000,ConanOBrien,A prehistoric village has been unearthed in Miami. Experts say the indigenous people ate fish and small game at around 4 in the afternoon.
434412389534924800,2014-02-14 19:42:39 +0000,ConanOBrien,"A survey found that, on Valentine’s Day, men spend $87.00 more than women. I.e., a survey found that, on Valentine’s Day, men spend $87.00."
434051781589360640,2014-02-13 19:49:43 +0000,ConanOBrien,Saw this Sid Caesar sketch when I was a kid. It made me want to make people laugh: http://t.co/Cm9UNBodP8
433664974544580608,2014-02-12 18:12:41 +0000,ConanOBrien,"I’d like to retire somewhere warm, like Sochi."
433425863653085184,2014-02-12 02:22:33 +0000,ConanOBrien,I just found out the “L” in Samuel L. Jackson stands for Laurence Fishburne.
433056295386894337,2014-02-11 01:54:01 +0000,ConanOBrien,"Still no interest in a reunion of my old Irish-American boy band, Pale By Comparison."
432567839497531392,2014-02-09 17:33:04 +0000,ConanOBrien,Americans now read Facebook more than the Bible. I guess nobody wants to read about a guy who could only come up with 12 friends.
432230648158240770,2014-02-08 19:13:11 +0000,ConanOBrien,"I love to go up to Spanish people and say, “any FLANS for the weekend?” They love that."
432022906583777280,2014-02-08 05:27:42 +0000,ConanOBrien," Still holding out hope that ""Blending In With a White Wall"" will become an Olympic event."
431620216460566528,2014-02-07 02:47:33 +0000,ConanOBrien,Can't wait til Sunday to see the cast of @WalkingDead_AMC? Watch #CONAN tonight. Spoiler alert: I eat two of them. http://t.co/xvQ4GlMdEl
431572380322779136,2014-02-06 23:37:28 +0000,ConanOBrien,Here I am getting my usual pre-show facial for the cast of @WalkingDead_AMC on #CONAN tonight: http://t.co/kxwinml1r1
431323135258796033,2014-02-06 07:07:03 +0000,ConanOBrien,Watching luge always makes me want to go outside and not luge.
430773855351627776,2014-02-04 18:44:25 +0000,ConanOBrien,"Just read a study claiming dogs can feel love, which is yet another way dogs are superior to cats. And comedians."
430444558569046016,2014-02-03 20:55:54 +0000,ConanOBrien,"After seeing that commercial with the horse & puppy, my kids wouldn’t stop bugging me. So I caved and bought them a case of Bud."
430133424288845824,2014-02-03 00:19:34 +0000,ConanOBrien,Download the #NewU2Song 'Invisible' for FREE now and $1 goes to support @RED's fight against AIDS. http://t.co/B55BEqDKWM #U2Invisible
429688026785001473,2014-02-01 18:49:43 +0000,ConanOBrien,My Super Bowl tradition? Watching the game at a Hampton Inn with a drifter.
429345762569248768,2014-01-31 20:09:41 +0000,ConanOBrien,A bridal shop is now using female mannequins that have back fat. They’re right next to the male mannequins that have second thoughts.
429079779933835264,2014-01-31 02:32:46 +0000,ConanOBrien,It's the return of Puppy Conan. His wig looks better than mine. http://t.co/PsR3iROusK
429001971345793024,2014-01-30 21:23:35 +0000,ConanOBrien,Queen Elizabeth is in financial trouble. How do you go broke when your face is on the money?
428601472721240064,2014-01-29 18:52:08 +0000,ConanOBrien,"At this time, Eva Mendes and I ask for privacy about our burgeoning relationship. Thank you."
428346002127339520,2014-01-29 01:56:59 +0000,ConanOBrien,Anyone else still quietly mutter “choo-choo” when they bring their fork to their mouth? Me neither.
428071195502592001,2014-01-28 07:45:00 +0000,ConanOBrien,I wish a wall mount was as dirty as it sounds.
427583203675627520,2014-01-26 23:25:54 +0000,ConanOBrien,"I hate the Paparazzi, always photographing me when I’m with my family or searching through Nick Jonas’ trash."
427243573038157824,2014-01-26 00:56:20 +0000,ConanOBrien,"Just saw Her. (Not the movie, the capitalized object pronoun.)"
426865115414020096,2014-01-24 23:52:28 +0000,ConanOBrien,Just read part of an incredible synopsis of an article about Attention Deficit something or other.
426533888521797632,2014-01-24 01:56:18 +0000,ConanOBrien,"Someone captured the moment when I pitched Wayne Gretzky my new nickname: ""The Other Great One"": http://t.co/JgrX7qzdN5"
426441113969229824,2014-01-23 19:47:39 +0000,ConanOBrien,The Toronto City Counselor says that Mayor Rob Ford is unable to change. I imagine he means out of that suit.
426056963655348224,2014-01-22 18:21:10 +0000,ConanOBrien,Just snaked my bathroom drain and pulled out an Ewok.
425715885618110464,2014-01-21 19:45:51 +0000,ConanOBrien,"When someone calls me pretentious, the white gloves come off."
425337528153956352,2014-01-20 18:42:23 +0000,ConanOBrien,That last episode of “Sex Sent Me to the E.R.” got the color wrong on my Speedo.
425002938352689152,2014-01-19 20:32:51 +0000,ConanOBrien,Did you know the Broncos have an entire coaching unit solely dedicated to containing Tom Brady’s handsomeness?
424726840528207873,2014-01-19 02:15:44 +0000,ConanOBrien,"When the phone rings at Meryl Streep’s house, do you think she says, “Don’t answer it, it’s just another one of those Oscar nominations”?"
424296291611340800,2014-01-17 21:44:53 +0000,ConanOBrien,"You asked for it, here it is: Outtakes of @KevinHart4real, @IceCube, and me trying to score weed: http://t.co/wj6GQSTZlw"
423899161990160384,2014-01-16 19:26:50 +0000,ConanOBrien,Nigeria’s leader has banned same sex marriage. I’m not sending their prince any more money.
423564044197318656,2014-01-15 21:15:12 +0000,ConanOBrien,Very excited @WBHomeEnt is releasing the Batman '66 Complete TV Series in 2014! The seat smells like Adam West: http://t.co/cqWjlpW1Gn
423192462195060736,2014-01-14 20:38:40 +0000,ConanOBrien,"A kid in New Jersey is falsely claiming to be my illegitimate son. For the record, I have three children: Neve,  Beckett, and @RonanFarrow."
423185729515028480,2014-01-14 20:11:54 +0000,ConanOBrien,"Last night, I was reading “Bridge to Terabithia” to my kids when Chris Christie showed up and shut it down."
422793965092339712,2014-01-13 18:15:11 +0000,ConanOBrien,Dreamt that I bought some new boots and a sturdy umbrella for the Morton Salt girl.
422504372858146817,2014-01-12 23:04:26 +0000,ConanOBrien,"Don’t hate the playa, unless he’s playing lacrosse."
422088271552720896,2014-01-11 19:31:00 +0000,ConanOBrien,Fox News is starting a channel for children. It’s going to call President Obama a “Socialist Kenyan Muslim With Cooties.”
421749860669198336,2014-01-10 21:06:17 +0000,ConanOBrien,"Kim Jong Un & Nicolas Cage have birthdays this week. So happy birthday to a madman unleashing terrible things on the world, and Kim Jong Un."
421391302115090432,2014-01-09 21:21:30 +0000,ConanOBrien,If Chris Christie had blocked people from entering New Jersey he’d be a hero.
421135242594758656,2014-01-09 04:24:00 +0000,ConanOBrien,"When I’m in Colorado, ladies, it’s not just Mountain Time, it’s mountin’ time. My God, how do I delete this tweet?"
420813545370963968,2014-01-08 07:05:42 +0000,ConanOBrien,Nothing attracts paparazzi like filling your grocery cart with Oat Bran and Charmin.
420407769762525184,2014-01-07 04:13:17 +0000,ConanOBrien,Writing a cookbook for sharks was a waste of my time.
419988403652812800,2014-01-06 00:26:53 +0000,ConanOBrien,Anyone else lie awake at night wondering how to steal Jason Bateman's likability?
419684543289769984,2014-01-05 04:19:27 +0000,ConanOBrien,"FUN FACT: Each new member of One Direction is grown humanely at Direction Labs facilities, using only the finest polymer-based additives."
419255757758930944,2014-01-03 23:55:36 +0000,ConanOBrien,I’ve already broken my New Year’s Resolution to not camp out on Jennifer Lawrence’s driveway.
418813207986176000,2014-01-02 18:37:04 +0000,ConanOBrien,One sign the economy’s picking up: It’s reportedly just recently gotten “less hard out there for a pimp.”
418531577270779904,2014-01-01 23:57:58 +0000,ConanOBrien,"January is named for actor Jan-Michael Vincent, who was famous for exactly 31 days one winter."
418197284321361920,2014-01-01 01:49:36 +0000,ConanOBrien,New Year’s Eve is just a made up holiday created by the taxi industry to get more vomit in cars.
417729680699949056,2013-12-30 18:51:31 +0000,ConanOBrien,"Friends are asking about my New Year’s plans, but drinking off-brand gin & browsing http://t.co/5PN4QhsFL2 isn’t really something you plan."
417435826335645696,2013-12-29 23:23:51 +0000,ConanOBrien,I consider 2013 a pretty good year for me because I didn’t appear in any pistachio commercials.
416993839434309632,2013-12-28 18:07:33 +0000,ConanOBrien,"“Auld Lang Syne” is actually Scottish for “God, this haggis sucks.”"
416659432806682624,2013-12-27 19:58:44 +0000,ConanOBrien,The sights and sounds of Christmas in Boston! http://t.co/aI1KYr787K
416408818851921921,2013-12-27 03:22:53 +0000,ConanOBrien,It’s amazing how fast the gift of a Hickory Farms taffy log can be turned into a weapon by an unappreciative wife.
415903106157641728,2013-12-25 17:53:22 +0000,ConanOBrien,I’m pretty sure Santa used my bathroom when he was here last night.
415569959616393216,2013-12-24 19:49:33 +0000,ConanOBrien,There’s nothing like the look of wonder on a child’s face on Christmas morning when he doesn’t get anything.
415192947575906304,2013-12-23 18:51:27 +0000,ConanOBrien,"Every Christmas, I tell my family the same thing: “I don’t need presents. Just the love of millions of strangers.”"
