ID,Posted at,Screen name,Text
577319621469954048,2015-03-16 04:04:58 +0000,ConanOBrien,"On this date in Ancient Rome, Caesar was brutally killed moments after inventing the salad."
576744317475155968,2015-03-14 13:58:55 +0000,ConanOBrien,"If I were a mobster, my nickname would be Conan “Murdered Immediately” O’Brien."
576121359064965120,2015-03-12 20:43:30 +0000,ConanOBrien,Marshawn Lynch is still trying to trademark the phrase “I’m just here so I won’t get fined.” Where does he get off stealing my wedding vow?
575694580579880960,2015-03-11 16:27:38 +0000,ConanOBrien,Making friends on Jury Duty. http://t.co/bMUvcEfnRg
575455463489187843,2015-03-11 00:37:28 +0000,ConanOBrien,A tech company demonstrated a drone that is controlled directly by the user’s brain. It was part of the 2015 What Could Go Wrong? Festival.
575044793404760064,2015-03-09 21:25:37 +0000,ConanOBrien,"Sam Simon's contribution to the spirit of sharp, well-observed comedy is incalculable. Awful to lose such a gifted & genuinely good guy."
575010482316185600,2015-03-09 19:09:16 +0000,ConanOBrien,"McDonald’s new CEO wants to change it into a “modern, progressive company” - so Burger King says it’s planning to transition to a democracy."
574659765659267072,2015-03-08 19:55:39 +0000,ConanOBrien,"I’m sorry that Boston has had so much snow this winter, but I’m happy the Arby's sandwich I left in my parents’ backyard is still good."
574357150417313792,2015-03-07 23:53:10 +0000,ConanOBrien,Learn how you can win a chance to be on #TheSimpsons & help fight the battle against autism: http://t.co/Dhk8mienvr #NightOfTooManyStars
573921731364061185,2015-03-06 19:02:58 +0000,ConanOBrien,"Dave Franco asked me to tweet about his great new flick #UnfinishedBusiness, but I refused."
573556809073455104,2015-03-05 18:52:54 +0000,ConanOBrien,The only bad part of my visit to Cuba was having to leave it. Watch the full #ConanCUBA episode now. http://t.co/ckq54vpP3w
573350977874472962,2015-03-05 05:15:00 +0000,ConanOBrien,Thanks for watching #ConanCUBA. I had a fantastic time making new friends with the Cuban people & I can’t wait to go back.
573350611661414400,2015-03-05 05:13:32 +0000,ConanOBrien,I took this pic of my assistant Sona acclimating to the Cuban lifestyle a little too easily. #ConanCUBA http://t.co/KvKDakRolT
573349534098583552,2015-03-05 05:09:15 +0000,ConanOBrien,It was nice of Cuba to name their absurdly-shaped taxis after me. #ConanCUBA http://t.co/omhBShlWHp
573347973741985792,2015-03-05 05:03:03 +0000,ConanOBrien,A caricature from a Cuban street artist. At least he got my hair and hand right. #ConanCUBA http://t.co/I1wnOxWMhB
573346110158209024,2015-03-05 04:55:39 +0000,ConanOBrien,An iconic American writer known for his rugged manliness poses with Ernest Hemingway. #ConanCUBA http://t.co/7TqcVcj9p0
573344669196681216,2015-03-05 04:49:56 +0000,ConanOBrien,Shared a lot of laughs with the kids down by the sea wall in El Malecon. #ConanCUBA http://t.co/fNrIV3pPRJ
573342779943723008,2015-03-05 04:42:25 +0000,ConanOBrien,All that rumba dancing exhausted me. Recharging my batteries with my assistant Sona. #ConanCUBA http://t.co/1S82g9AvZT
573336953074003968,2015-03-05 04:19:16 +0000,ConanOBrien,Snapped on my iPhone: the champagne of cervezas. #ConanCUBA http://t.co/eZjeZt1FlN
573334812443844608,2015-03-05 04:10:45 +0000,ConanOBrien,"My fantastic band in Cuba. They were playing in the café in the background, and I hired them on the spot! #ConanCUBA http://t.co/gBhiP158c9"
573333389048082433,2015-03-05 04:05:06 +0000,ConanOBrien,The only dog in Cuba who didn't bark at me. #ConanCUBA http://t.co/IwhdwhRZFw
573332151438979072,2015-03-05 04:00:11 +0000,ConanOBrien,#ConanCUBA starts now on TBS. I'll be sharing some photos and commentary here for the next hour.
573312500894048257,2015-03-05 02:42:06 +0000,ConanOBrien,RT @TeamCoco: #ConanCUBA is TONIGHT @ 11/10c on TBS.  Watch the first four minutes now @ http://t.co/WsGrYDcCUa
572866733326778368,2015-03-03 21:10:47 +0000,ConanOBrien,Seeing Cuba the way it was meant to be seen. #ConanCUBA airs tomorrow night. http://t.co/2kdyrPVXqR
572582056674242561,2015-03-03 02:19:35 +0000,ConanOBrien,This iconic Che Guevara image was born right here in Havana. #ConanCUBA http://t.co/ba53Jg33Fd
572180426397114368,2015-03-01 23:43:38 +0000,ConanOBrien,"The food in Cuba was incredible. Now that I'm back in California, I've got to get me some of this ""fruit"". #ConanCUBA http://t.co/ZtCkMAILJ4"
571796925206298626,2015-02-28 22:19:45 +0000,ConanOBrien,"Jamming with the locals in Cuba. Playing @TaylorSwift13's ""Blank Space"". #ConanCUBA airs 3/4. http://t.co/Pkzw3LVgUX"
571453287225954304,2015-02-27 23:34:15 +0000,ConanOBrien,One of many friends I made in Cuba. #ConanCUBA premieres 3/4. http://t.co/Dnv51sq1mN
571408432403607552,2015-02-27 20:36:01 +0000,ConanOBrien,.@TheSimpsons I got to meet Leonard Nimoy the day we recorded his voice for the Monorail episode. I was in awe --- such a terrific man.
571109136181514240,2015-02-27 00:46:43 +0000,ConanOBrien,"Shared ""Conan"" with some kids in Cuba, who asked me in Spanish ""Seriously, what's your real job?"" http://t.co/k5jWpQakDF #ConanCUBA"
570713575200677888,2015-02-25 22:34:54 +0000,ConanOBrien,They do taxis differently in Cuba. #ConanCUBA airs March 4th. http://t.co/zlXDkL20EG
570403619339509763,2015-02-25 02:03:15 +0000,ConanOBrien,"Tonight on CONAN, I try out @Grindr with @BillyEichner. My God, what have I done. http://t.co/ZcFkfseo2I http://t.co/fU6MRSIFFf"
570311329740931072,2015-02-24 19:56:31 +0000,ConanOBrien,The countdown to #ConanCUBA begins. Here's a behind the scenes peek at my Cuban talk show desk. http://t.co/agosc74NgO
570076658406797312,2015-02-24 04:24:01 +0000,ConanOBrien,That unreleased book by Dr. Seuss they just discovered proves that Fifty Shades of Grey was completely plagiarized.
569586687921115137,2015-02-22 19:57:03 +0000,ConanOBrien,"Hey @RickyGervais -- when I stare out my window without genitalia, you should respect my privacy."
569349614618353664,2015-02-22 04:15:00 +0000,ConanOBrien,"Now that those new, untouched photos of Beyoncé have surfaced, the truth is out: I am the one they call Beyoncé."
568979470335373313,2015-02-21 03:44:11 +0000,ConanOBrien,"Just gave my daughter “the talk”, where I explain that one day, Joe Biden might place his hands on her shoulders."
568569804157628416,2015-02-20 00:36:19 +0000,ConanOBrien,Man—tonight’s audience was rough. http://t.co/kDLPgoJcRY
568167121353469952,2015-02-18 21:56:12 +0000,ConanOBrien,"I'm not one to promote other comedy shows, but ""Man Seeking Woman"" (that airs Wednesdays at 10:30pm on FXX) is absolutely hilarious."
567885012013486082,2015-02-18 03:15:12 +0000,ConanOBrien,"I don’t know why, but I’m a much better dancer when I’m in Cuba. http://t.co/2ytRWKuIe6"
567480648277823488,2015-02-17 00:28:24 +0000,ConanOBrien,"2/2: experiences of my life. Many laughs, but that could also be the rum. Watch #ConanCUBA March 4th. http://t.co/Oa7YW5Pmsy"
567480556498059264,2015-02-17 00:28:02 +0000,ConanOBrien,1/2: I just spent the last four days shooting my show all around the city of Havana. I made countless friends and had one of the best
567146424358694914,2015-02-16 02:20:19 +0000,ConanOBrien,I put the “erectile fun” in “erectile dysfunction.”
566628143407325185,2015-02-14 16:00:51 +0000,ConanOBrien,I may have just swallowed a candy heart with a stent.
566342375908581378,2015-02-13 21:05:19 +0000,ConanOBrien,"Puerto Rico may fine parents up to $800 if their kids are obese. Well, Puerto Rico, I guess you're not interested in statehood."
565952301203214336,2015-02-12 19:15:18 +0000,ConanOBrien,Saw the “Fifty Shades of Grey” movie. It’s 90 minutes of some half-naked guy searching for a tiny handcuff key.
565910237308125185,2015-02-12 16:28:09 +0000,ConanOBrien,#TheWalkingDead's @SteveYeun & I got naked at a Korean spa. You've been warned. http://t.co/bD6A5b8Dr6 #CONAN
565594996418813952,2015-02-11 19:35:30 +0000,ConanOBrien,"I think Master Chef Jr. might be fixed. They just showed a close-up of a kid's hand, and it had liver spots and a wedding band."
565213515560910848,2015-02-10 18:19:37 +0000,ConanOBrien,"Kanye West just ran up, grabbed my “World’s Greatest Dad” mug, and gave it to a more deserving recipient."
564816594346713088,2015-02-09 16:02:24 +0000,ConanOBrien,My accountant says I can no longer deduct my own tears as a “cost of business”.
564497722120892417,2015-02-08 18:55:19 +0000,ConanOBrien,The author of “50 Shades of Grey” has finished her next book. But she won’t release it unless you say the safe word.
564152951871406080,2015-02-07 20:05:19 +0000,ConanOBrien,"I'm shocked. Back when Brian Williams and I killed Osama Bin Laden, he seemed like an honest guy."
563756629016211457,2015-02-06 17:50:29 +0000,ConanOBrien,"Looking back on my life so far, I’m proud to say I’ve only committed speakable horrors."
563366859823906818,2015-02-05 16:01:40 +0000,ConanOBrien,Just found out my audition tape for “Magic Mike” was immediately sent over to “Tragic Mike.”
563012964685713409,2015-02-04 16:35:25 +0000,ConanOBrien,My trainer says he can get me in “Hemsworth brother after a bout with mono” shape.
562718530559545344,2015-02-03 21:05:27 +0000,ConanOBrien,"I don’t know about you, but I always set my Doomsday Clock five minutes ahead."
562298284644257792,2015-02-02 17:15:32 +0000,ConanOBrien,"I can’t believe I didn’t win the Super Bowl office pool with the numbers I drew, ½ and Pi."
561947176130342913,2015-02-01 18:00:21 +0000,ConanOBrien,The Big Question: Will @MoneyLynch or @RobGronkowski do my touchdown dance today? #SB49: http://t.co/el3zSlPn96
561715603355230208,2015-02-01 02:40:10 +0000,ConanOBrien,"Hot wings, bean dip, 20 dudes in my living room – plans are all set for Valentine’s Day!"
561322324142469120,2015-01-31 00:37:25 +0000,ConanOBrien,Just ruminating on how different my life would be now if my childhood nickname had been “Gronk” instead of “There he is—Get him!”
561180751992201216,2015-01-30 15:14:52 +0000,ConanOBrien,The winner of #SB49 will be decided by @MoneyLynch & @RobGronkowski playing #MortalKombatX on #CONAN: https://t.co/3o8Ft5joLn
560532707881398272,2015-01-28 20:19:46 +0000,ConanOBrien,Sports Illustrated laid off all its photographers. Good luck finding someone willing to take pictures of hot swimsuits models for free.
559938916996747264,2015-01-27 05:00:15 +0000,ConanOBrien,"For the Super Bowl, I have one of those curved TVs. Problem is, it wasn’t like that when I put it in my car."
559591553149456385,2015-01-26 05:59:57 +0000,ConanOBrien,Word is that Jeb Bush is working on a 2016 campaign slogan. So far the frontrunner is: “Vote Bush – Because it’s Been the Required 8 Years.”
559212520599060480,2015-01-25 04:53:49 +0000,ConanOBrien,"If your name is cool forwards, it's cool backwards. Case in point: Ksum Nole."
558701606422577152,2015-01-23 19:03:37 +0000,ConanOBrien,"AG Eric Holder ended the federal civil forfeiture program. Holder said, ""It was the right thing to do, whatever the hell it is."""
558448651404468224,2015-01-23 02:18:28 +0000,ConanOBrien,"Join me, John @Mulaney, @SarahKSilverman, & @NickKroll for a night of laughs & a great cause. http://t.co/lPG9twrsYY #Innocenceproject"
557726197300613120,2015-01-21 02:27:42 +0000,ConanOBrien,Tonight I become the 1st late night host to kill Russian mobsters with #ArcherFX's @codenameduchess: http://t.co/0MW3Js0U2N
557629347268681728,2015-01-20 20:02:51 +0000,ConanOBrien,Remember “planking?” Me neither.
557433824549023744,2015-01-20 07:05:55 +0000,ConanOBrien,Nothing makes me feel sexier than overpaying for a blazer.
556957169044971520,2015-01-18 23:31:51 +0000,ConanOBrien,Idea for 2015: haikus go to 6-8-6.
556567466009427968,2015-01-17 21:43:19 +0000,ConanOBrien,"Liam Neeson denied he made a remark that he was converting to Islam. You can see it all in the new action thriller, Taken…Out of Context."
556189208394469377,2015-01-16 20:40:15 +0000,ConanOBrien,Two men climbed El Capitan using only their hands and feet. It’s like that time I walked to the bathroom without my slippers.
555879928210526209,2015-01-16 00:11:17 +0000,ConanOBrien,"Discovery Channel has said that from now on they will only air factual documentaries. Or as they were known in the old days, documentaries."
555609300375470080,2015-01-15 06:15:54 +0000,ConanOBrien,"At Dartmouth, 64 students are being accused of cheating in an ethics course. They've all been given an honorary doctorate in Irony."
555019032718745601,2015-01-13 15:10:23 +0000,ConanOBrien,I’m beginning to think I didn’t get that role as young @icecube in “Straight Outta Compton.”
554640273058590720,2015-01-12 14:05:20 +0000,ConanOBrien,"Same-sex couples can now get married in Florida, and are pledging ""Til Meth Do Us Part."""
554314475755806720,2015-01-11 16:30:44 +0000,ConanOBrien,I still think those North Korean hackers are hiding in a RadioShack in Toledo.
553924281021657088,2015-01-10 14:40:14 +0000,ConanOBrien,I can’t believe the Consumer Electronics Show rejected my idea of a walker made entirely of Slinkys.
553704254674706432,2015-01-10 00:05:56 +0000,ConanOBrien,"I hope oil stays at under $50 a barrel, because Valentine's Day is coming up."
553011798056521730,2015-01-08 02:14:21 +0000,ConanOBrien,Very sad day. #JeSuisCharlie http://t.co/IF0tQXmyTV
552679333307756544,2015-01-07 04:13:16 +0000,ConanOBrien,DOWNTON ABBEY SPOILER: Carson finds an oil of camphor stain on a drawing room divan.
552212816346628096,2015-01-05 21:19:29 +0000,ConanOBrien,"Of all the things I thought might happen in 2015, a sex scandal involving Prince Andrew and Alan Dershowitz was pretty low on the list."
551886473633361921,2015-01-04 23:42:43 +0000,ConanOBrien,"The Pope is being hailed for picking 15 diverse cardinals from unusual places. Congratulations, Cardinal Rabbi Mo Fensen of Bozeman, MT."
551491532558061568,2015-01-03 21:33:22 +0000,ConanOBrien,Just spent 72 hours sitting motionless in a darkened room. Perhaps it was a mistake to binge-watch “Black Mirror.”
551148333210009600,2015-01-02 22:49:37 +0000,ConanOBrien,"Wondering how long it will take me to learn to write “2015” on checks, but first must re-learn how to write checks."
550683001383043076,2015-01-01 16:00:33 +0000,ConanOBrien,Just found out “Auld Lang Syne” is Latin for “Made Up Words.”
550443388328488961,2015-01-01 00:08:25 +0000,ConanOBrien,"Damn, today’s @nytimes crossword has 2 clues about me, and I still can’t fill in an answer."
549975812066521089,2014-12-30 17:10:26 +0000,ConanOBrien,"Don’t cross Mr. I, or he becomes Mr. T."
549682551624044544,2014-12-29 21:45:07 +0000,ConanOBrien,"Ladies, I’m 6 foot 4 inches of misplaced confidence."
549312880349564928,2014-12-28 21:16:11 +0000,ConanOBrien,There are 2 Reds on the season finale of @TheComebackHBO. Watch and live tweet tonight at 10. #TheComeback
549018155885281281,2014-12-28 01:45:03 +0000,ConanOBrien,"Just ate at an online virtual steakhouse, Amazon Prime."
548561467147288576,2014-12-26 19:30:20 +0000,ConanOBrien,"As much as I love the theme music from the Serial podcast, it really killed the vibe at my Zumba class."
548146295190597634,2014-12-25 16:00:35 +0000,ConanOBrien,I love seeing the look on my kids’ faces on Christmas morning when I tell them we’re Hindu.
547931026232983552,2014-12-25 01:45:11 +0000,ConanOBrien,"‘Twas the night before Christmas, when all through the house, not a creature felt like pronouncing “it was” as two words."
547836710563110912,2014-12-24 19:30:24 +0000,ConanOBrien,Got all my Christmas shopping done. Now to shop for other people.
547512397234454528,2014-12-23 22:01:42 +0000,ConanOBrien,"Didn't know you could squeeze up to 3 ounces of liquor out of a department store Santa's beard. Thanks, Martha Stewart!"
547164800233766912,2014-12-22 23:00:28 +0000,ConanOBrien,"My wife wants our Christmas gifts to be handmade this year, so I carved her a Radio Shack gift card."
547089364581642240,2014-12-22 18:00:43 +0000,ConanOBrien,All I want for Christmas is a cat-fight between Flo the Progressive Lady and Lily the AT&T Lady.
546692863573393408,2014-12-21 15:45:10 +0000,ConanOBrien,My Christmas present to all of you?  I took a naked selfie and deleted it.
546387192265076736,2014-12-20 19:30:32 +0000,ConanOBrien,I’m pretty sure I saw this department store Santa in an old episode of “Dateline.”
546064931616219136,2014-12-19 22:09:59 +0000,ConanOBrien,Crossed Kim Jong-un off my Christmas list. You have to take a stand somewhere.
546033611087314945,2014-12-19 20:05:32 +0000,ConanOBrien,My father-in-law just found out I’m that “Conan O’Brien.”
545715282795577344,2014-12-18 23:00:36 +0000,ConanOBrien,"Tonight I hang w/@IceCube & @KevinHart4Real, get drunk with dolls, & blow up a strip club on my TBS primetime special ""#CONAN To Go"". 10/9c."
545286117227266048,2014-12-17 18:35:15 +0000,ConanOBrien,“Unbroken” was the original title for “The Human Centipede.”
544907581597429760,2014-12-16 17:31:06 +0000,ConanOBrien,"Today I saw a truck carrying Viagra. And get this, it was a semi. By the way - no charge for that tweet."
544731526353928194,2014-12-16 05:51:31 +0000,ConanOBrien,Did they really get a guy named “Christian” to play Moses?
544314702986493954,2014-12-15 02:15:12 +0000,ConanOBrien,Star Wars’ producers revealed the names of their new characters.  One of them is Charles Schwab.
543956012953530368,2014-12-14 02:29:54 +0000,ConanOBrien,"I hope North Korean hackers don’t release the embarrassing emails I sent to Andy, slavishly praising our new boss Kevin Reilly."
543597239470268416,2014-12-13 02:44:16 +0000,ConanOBrien,"Don't tell anyone, but I got my father-in-law this @thirdmanrecords album: http://t.co/CmWsdXg4l3. It sure beats last year's gel insoles."
543312038601043968,2014-12-12 07:50:58 +0000,ConanOBrien,Tired of the weird looks I get whenever I pronounce the “t” in Christmas.
542762542607511552,2014-12-10 19:27:28 +0000,ConanOBrien,"I work out, I eat right - I don’t understand why I’m developing breasts!

Wait, am I not texting my doctor right now?"
542455384498118656,2014-12-09 23:06:56 +0000,ConanOBrien,My high school marching band will regret cutting me from color guard after they see @FWong & me in #YouTubeRewind: http://t.co/5ql0soD9hQ
542050985724506114,2014-12-08 20:20:00 +0000,ConanOBrien,"I’m what’s known as a “Tiger Dad.” If my kids don’t get straight As, I threaten to practice the violin."
541747780814131200,2014-12-08 00:15:10 +0000,ConanOBrien,"Once again, missed the Fantasy Football playoffs. That’s what I get for drafting all kickers."
541373064777568256,2014-12-06 23:26:11 +0000,ConanOBrien,I had a hunch China had passed America as the #1 economy when they started making all our “America is #1” hats.
541021069960704000,2014-12-06 00:07:29 +0000,ConanOBrien,"Can’t believe I didn’t get a Grammy nomination for my jazz album, “Ginger Odysseys, Vol. 9.”"
540734361147310080,2014-12-05 05:08:12 +0000,ConanOBrien,"Sorry about that, my son said he was just going to use my phone to play Angry Birds."
540733876344483842,2014-12-05 05:06:17 +0000,ConanOBrien,Butt butt butt.
540221427173978112,2014-12-03 19:09:59 +0000,ConanOBrien,"It just hit me: if they are real, we are stepping in piles and piles of ghost dung."
539956361140764672,2014-12-03 01:36:43 +0000,ConanOBrien,"As we get closer and closer to the end of this tweet, I think it's important that we lower our expectations."
539536056941424640,2014-12-01 21:46:34 +0000,ConanOBrien,I'm gonna get a bunch of #CyberMonday deals as soon as this thing boots up. http://t.co/f1DakGBVMI
539116370626359297,2014-11-30 17:58:53 +0000,ConanOBrien,You can tell Charles Manson really loves his fiancée by the way he hasn’t murdered her.
538751520662384641,2014-11-29 17:49:06 +0000,ConanOBrien,"Still eating, mostly because that grass-fed turkey from Colorado gave me the munchies."
538398699668639744,2014-11-28 18:27:07 +0000,ConanOBrien,"The Greatest Generation stormed Normandy so that today, we could storm Target."
538039092488196097,2014-11-27 18:38:10 +0000,ConanOBrien,"I granted my turkey a last request, so now I've got to wait while it watches the entire run of ""Breaking Bad."""
537678289410985984,2014-11-26 18:44:28 +0000,ConanOBrien,I wonder if sales of Butterball turkeys would be as high if they'd used the name MargarineOrb.
537370898915811328,2014-11-25 22:23:00 +0000,ConanOBrien,My wife told me a turducken was as close to a threesome as I’m ever going to get.
536977407559753728,2014-11-24 20:19:25 +0000,ConanOBrien,Stopped at a quaint Diner in a small town in rural Connecticut. This photo is in the Men's room. Why?? http://t.co/y5B5r5dRZU
536685586636349440,2014-11-24 00:59:49 +0000,ConanOBrien,I’ve been working out and now have the strength of ten men. And they’re all Regis Philbin.
536311736614531072,2014-11-23 00:14:16 +0000,ConanOBrien,Who has less-recognizable names? New Republican Congressmen or former Arena Football players?
535879370905112576,2014-11-21 19:36:12 +0000,ConanOBrien,"In preparation for Thanksgiving, I¹m going to swallow an SUV’s airbag and then run into a wall."
535693894764474368,2014-11-21 07:19:11 +0000,ConanOBrien,"Just read that Jaden and Willow Smith interview to my dog, and he looks less confused than I am."
535156673065660416,2014-11-19 19:44:28 +0000,ConanOBrien,I took emotional Vulcan Jordan Schlansky coffee tasting. Watch the life drain from my eyes in the first minute: http://t.co/ADI00JKtKQ
534946660519264256,2014-11-19 05:49:57 +0000,ConanOBrien,"A 10-second kiss can transfer 80 million bacteria, my wife told me as we shook hands."
534404338781659136,2014-11-17 17:54:57 +0000,ConanOBrien,I just joined the Mile High Club for people who tweet on the toilet.
534154653177769984,2014-11-17 01:22:48 +0000,ConanOBrien,"These days HD is so good, when you watch an NFL game you can see the murder evidence."
533643654494027776,2014-11-15 15:32:16 +0000,ConanOBrien,"I’m grateful for those Kim Kardashian nude photos, because they reminded me to check my car’s oil."
533438150471733248,2014-11-15 01:55:40 +0000,ConanOBrien,Just saw my Thanksgiving turkey playing beach volleyball in Malibu.
532996440818073600,2014-11-13 20:40:28 +0000,ConanOBrien,Fight muscular dystrophy! Text CD10 to 50555 to donate $10 to http://t.co/zJyYyH1Xoc & share your pic. #CureDuchenne http://t.co/yE7IaeJ1eA
532757616439468032,2014-11-13 04:51:28 +0000,ConanOBrien,"My new 3D printer not only prints food, but also some really rude waiters."
532362801126203392,2014-11-12 02:42:37 +0000,ConanOBrien,"Check out my cinematic badass tribute to @SonsOfAnarchy. Ladies, If you're allergic to orgasms, do not click: http://t.co/3bNtFatjPj"
532213791405391873,2014-11-11 16:50:30 +0000,ConanOBrien,I'm talking to the cast of @SonsOfAnarchy tonight. I haven't been with this many men in black leather since every time my wife leaves town.
532020604384186369,2014-11-11 04:02:51 +0000,ConanOBrien,"Tonight on #CONAN I play #AssassinsCreed Unity, or as I prefer to think of it, ""Super Violent Les Miz Roleplay."" http://t.co/bsSU23n4Dm"
531593935056285696,2014-11-09 23:47:25 +0000,ConanOBrien,"NPR just told me I'm the murderer in the next ""Serial"" podcast."
531144914638106625,2014-11-08 18:03:10 +0000,ConanOBrien,So embarrassed - my wife walked in while I was watching that video on how McRibs are made.
530904985123295232,2014-11-08 02:09:46 +0000,ConanOBrien,I guess we can finally put an end to the rumors that I killed Bin Laden.
530619326509101057,2014-11-07 07:14:40 +0000,ConanOBrien,It’s too bad. Conan Cumberbatch had a nice ring to it.
530068617279180800,2014-11-05 18:46:21 +0000,ConanOBrien,Take a @Stand4Heroes & help support our injured service members: http://t.co/PqhuKu1djN #Stand4Heroes
529761666271961088,2014-11-04 22:26:38 +0000,ConanOBrien,"Martin Short's terrific new book is out today. I'm mentioned in the chapter ""Punks Who Ripped Me Off."""
529748018900500480,2014-11-04 21:32:24 +0000,ConanOBrien,"RT @AndyRichter ""URGENT: #GoVote #GoVote #GoVote http://t.co/YnVOAAoEA9"" http://t.co/BsRhRPJS4Z"
529693413575106560,2014-11-04 17:55:25 +0000,ConanOBrien,"I just voted, and now I look to the horizon with confidence: http://t.co/EXgrW4jdTY"
529481196732813312,2014-11-04 03:52:09 +0000,ConanOBrien,Tonight on #CONAN I play @CallofDuty: #AdvancedWarfare. Watch and become erect. http://t.co/jdqPNNmji5
529044116332892160,2014-11-02 22:55:21 +0000,ConanOBrien,Let’s just agree any group of 3 or more handsome British men should be referred to as a “cumberbatch.”
528776731167965184,2014-11-02 05:12:51 +0000,ConanOBrien,"It’s November 1st, which means today America’s trash cans are filled with thousands of unopened Fun-Size Almond Joys."
528328833468858368,2014-10-31 23:33:04 +0000,ConanOBrien,"To be clear, I’m dressed as Hello Kitty for Hello Kitty Con, NOT Halloween."
527937189657604097,2014-10-30 21:36:49 +0000,ConanOBrien,Just called my broker and told him to buy 300 shares of Neil Patrick Harris.
527510764555223040,2014-10-29 17:22:21 +0000,ConanOBrien,"Massachusetts was just named the most liberal state. Researchers almost picked California, but then they stopped for gas in Bakersfield."
527271858022780928,2014-10-29 01:33:01 +0000,ConanOBrien,Tonight Ashton Kutcher talks about my two favorite topics: fatherhood and Charlie Sheen. http://t.co/SMAhxETYBP
526925967520829440,2014-10-28 02:38:35 +0000,ConanOBrien,"As if there weren’t already enough reasons to hate Ebola, I hear it also smokes e-cigarettes."
526418884904361984,2014-10-26 17:03:37 +0000,ConanOBrien,"Kenny G has angered all of China, yet no one is telling him to “stick to music.”"
