ID,Posted at,Screen name,Text
467144060260876288,2014-05-16 03:26:37 +0000,SimonCowell,My utmost respect to American idol reaching their 500th episode last night. A rare achievement. Congrats to all of the team.
466680370059288577,2014-05-14 20:44:05 +0000,SimonCowell,So very sad to hear that Stephen Sutton has passed away. He was a very brave person and an inspiration to millions. Rest in peace.
466388153839157248,2014-05-14 01:22:55 +0000,SimonCowell,Dates of where and when to audition to follow. Good luck.
466386174991683584,2014-05-14 01:15:03 +0000,SimonCowell,RT @syco: NEWS: @Univision teams with Syco to launch a new TV format â€˜La Bandaâ€™. Read more here: http://t.co/JfEbVoLOp0 http://t.co/P3HGZAOt7p
465975238401212418,2014-05-12 22:02:08 +0000,SimonCowell,A great reaction to my golden buzzer act BAM on  Britains Got Talent.If you haven't seen their audition have a look on YouTube.
465410428882157568,2014-05-11 08:37:47 +0000,SimonCowell,And all of us at @syco love and respect @Labrinthda1st as an amazing artist and as a truly great person.
465409609423798272,2014-05-11 08:34:32 +0000,SimonCowell,RT @Labrinthda1st: I love my label and all the people in it @syco thank you for believe in me..
464173167175430144,2014-05-07 22:41:21 +0000,SimonCowell,Very excited to announce @Sycoâ€™s new deal with @AnimalLogic. It is a dream come true. http://t.co/m7HdcbcGDI  @THR
463750936888745984,2014-05-06 18:43:34 +0000,SimonCowell,"If you are interested, I have done an interview with my good friend @ImPaulMcKenna on Hulu. Here is the link http://t.co/JRbdoEauEx"
463490333829910528,2014-05-06 01:28:01 +0000,SimonCowell,Nearly finished the second season of house of cards. It is so good. I think it's the best thing I have ever seen on TV.
463454958088507392,2014-05-05 23:07:27 +0000,SimonCowell,Mum and Eric. http://t.co/1W4NEqbfGx
463454468722274304,2014-05-05 23:05:30 +0000,SimonCowell,Oops I just sent a tweet to myself
463454062025768960,2014-05-05 23:03:53 +0000,SimonCowell,@SimonCowell
463453935231979520,2014-05-05 23:03:23 +0000,SimonCowell,Very handsome like his dad http://t.co/JTQIgWRDih
463453206282907649,2014-05-05 23:00:29 +0000,SimonCowell,http://t.co/boQ6eJl3nK
463452760055111680,2014-05-05 22:58:43 +0000,SimonCowell,And my little boy Eric is healthy and happy.
463451250785136642,2014-05-05 22:52:43 +0000,SimonCowell,Hearing very good reports on the one d stadium tour. I hear the shows are very special.
463450969280229376,2014-05-05 22:51:36 +0000,SimonCowell,Back to the uk today. Hope you are enjoying got talent. Next weeks show has a very special audition.
459473618678734848,2014-04-24 23:27:01 +0000,SimonCowell,And I have just seen the new video for the next Little Mix single. I think it's their best one yet.
459473056369373184,2014-04-24 23:24:47 +0000,SimonCowell,Please check out @EllaHenderson's video for Ghost. I love this song http://t.co/Lj1fJbS3YM
455605392769179649,2014-04-14 07:16:05 +0000,SimonCowell,I am in LA so it's goodnight from here. Simon.
455601625835384832,2014-04-14 07:01:06 +0000,SimonCowell,These are the times I love my job.
455601332745801728,2014-04-14 06:59:57 +0000,SimonCowell,"And the Ella Henderson video also great. I really think she is going to be a big star. 
Her debut album is stunning."
455600710072033281,2014-04-14 06:57:28 +0000,SimonCowell,Once again Ben has produced a fantastic video for One Direction. You and I. Very clever.
455596439075172352,2014-04-14 06:40:30 +0000,SimonCowell,Goodnight everyone. Simon.
455584111092969472,2014-04-14 05:51:31 +0000,SimonCowell,A huge thank you to everyone who watched britains got talent on Saturday. The ratings were really good.
455246407457202176,2014-04-13 07:29:36 +0000,SimonCowell,Good night.
455241915416330240,2014-04-13 07:11:45 +0000,SimonCowell,@Midastalentpr @GotTalent @tellymix
455240922381316096,2014-04-13 07:07:48 +0000,SimonCowell,She is 80 years old. Let her have that chance. You the viewers will decide.
455240616624922625,2014-04-13 07:06:35 +0000,SimonCowell,Don't knock paddy for performing on a Spanish talent show. She is British and wants the chance to perform in front of our royal family
455092369570816001,2014-04-12 21:17:30 +0000,SimonCowell,Age is nothing but a number!  @GotTalent  https://t.co/DvWjFJikZM
453249931923689472,2014-04-07 19:16:19 +0000,SimonCowell,"The few times I met Peaches she was a sweet, funny warm person. Much love to her family she has left behind."
453247781285941248,2014-04-07 19:07:46 +0000,SimonCowell,So sad to hear about Peaches. Rest in peace.
452985012070412288,2014-04-07 01:43:37 +0000,SimonCowell,Congratulations to Jermain the winner of the voice uk. You deserved it.
452980372322922497,2014-04-07 01:25:11 +0000,SimonCowell,Went to my mums house for lunch today. Diddly threw up five minutes before we arrived!
451879395276652544,2014-04-04 00:30:18 +0000,SimonCowell,Thanks to all the staff at Revolution Karting tonight. It was great fun and even better my team won!
451504618699509760,2014-04-02 23:41:04 +0000,SimonCowell,@Jason_Houghton 11
451504201668251648,2014-04-02 23:39:24 +0000,SimonCowell,I just watched the first cut of Britains Got Talent. It is fantastic.
451415604315299840,2014-04-02 17:47:21 +0000,SimonCowell,"RT @icantsingUK: *THE DADDY OF ALL MUSICAL TRAILERS*
Strap in and brace yourself for the BRAND NEW @icantsingUK Trailer! RT yeah? http://t.co/MIbBoo7eTq"
451167173168627712,2014-04-02 01:20:11 +0000,SimonCowell,I had a very humbling but rewarding day at the Shooting Star Chase hospice charity day. It's an incredible cause and needs a lot of support.
450677248849616896,2014-03-31 16:53:23 +0000,SimonCowell,Congrats Sam.
450677076971241472,2014-03-31 16:52:42 +0000,SimonCowell,For the record no character in I Can't Sing is based on James Arthur. Have no idea where that came from.
449259831200088064,2014-03-27 19:01:05 +0000,SimonCowell,Congrats to Sam Bailey on her debut album. It looks as if she is going to be number one this week.
449042934621831168,2014-03-27 04:39:13 +0000,SimonCowell,"And I spent time with  one of my god daughters ""trouble"" tonight, who is one of the most special people I have ever met."
449037052773154816,2014-03-27 04:15:50 +0000,SimonCowell,RT @rubiesmummy08: @SimonCowell plz simon im begging u to help us http://t.co/r0NRzFG9zs have a read of our story xx
449036667975110656,2014-03-27 04:14:19 +0000,SimonCowell,@TheArtofOil  I love it. Thank you.
449036394003185666,2014-03-27 04:13:13 +0000,SimonCowell,One day Paula Randy Me and Ryan will reunite. I know it will happen. It was a special time.
449034341923160064,2014-03-27 04:05:04 +0000,SimonCowell,Tonight was a special night. The I can't sing opening night was fantastic. Credit to the cast who were on top form. Check out the reviews.
448825766823096321,2014-03-26 14:16:16 +0000,SimonCowell,Going to the opening night of I Can't Sing at the Palladium. This been a blast.
446762260657373184,2014-03-20 21:36:38 +0000,SimonCowell,The Ella Henderson album is nearly finished. She has made an amazing album.
446644777300557824,2014-03-20 13:49:47 +0000,SimonCowell,Watched the first Grand Prix on Sunday. My mini makes more noise. Seriously.
446003402301267968,2014-03-18 19:21:12 +0000,SimonCowell,"If you think you've got star potential, here's the link to audition https://t.co/qkQHXQp0IB Good Luck!"
446003204086837248,2014-03-18 19:20:24 +0000,SimonCowell,"Very happy to be back on the UK show this year. The last year I was on it we found One Direction, Rebecca Ferguson, Cher and Matt Cardle"
445367616962850816,2014-03-17 01:14:49 +0000,SimonCowell,I absolutely love House Of Cards on Netflix.
445365059725062145,2014-03-17 01:04:39 +0000,SimonCowell,"I think this may be the most beautiful car in the world. It's made by Eagle. Thank you Henry,Paul and the team. http://t.co/evX73q1YBj"
445362882893852672,2014-03-17 00:56:00 +0000,SimonCowell,@TheRealMerovich I would love to.
445362773992951808,2014-03-17 00:55:34 +0000,SimonCowell,RT @TheRealMerovich: @SimonCowell bring Top of the Pops back.
443465482004611072,2014-03-11 19:16:24 +0000,SimonCowell,"RT @Antwren: Still blown away by last nights show 'I can't sing' - it's brilliant in so many ways - absolutely stunning, madly bizarre @icantsingUK"
443465207948800001,2014-03-11 19:15:19 +0000,SimonCowell,RT @AimzyK: #icantsing was hands down the best musical I have ever seen!!! My make up has fully run down my cheeks from laughter!
443150852917043200,2014-03-10 22:26:11 +0000,SimonCowell,Most importantly she is a brilliant judge of talent.
443149907034382336,2014-03-10 22:22:25 +0000,SimonCowell,Be careful what you wish for!
443149641253912576,2014-03-10 22:21:22 +0000,SimonCowell,It's official. Cheryl is back.
443140778265944064,2014-03-10 21:46:09 +0000,SimonCowell,"RT @n4rrator: @icantsingUK was so hilarious last night, I'm still laughing now! And the music was top notch #goseeit ðŸ‘ŒðŸ‘ŒðŸ‘Œ"
443140544223789056,2014-03-10 21:45:13 +0000,SimonCowell,RT @Lesterbuddy: @icantsingUK the most bonkers thing I've seen for ages.So so funny.I hate you for making me laugh @Riverdance - 1 of my favourite shows
443139952201969665,2014-03-10 21:42:52 +0000,SimonCowell,"RT @GeorgeHWheeler: @icantsingUK is quirky, emotional, hilarious all at once.. It's left me wanting to go again and again! #takemeback #icantsinguk"
443139297852784640,2014-03-10 21:40:16 +0000,SimonCowell,"RT @_hollyp: @icantsingUK what a great show, had me in stitches... As for @CynthiaEriVo voice, WOW!!! Gave me goosebumps on my goosebumps ðŸ‘Œ"
443099981252395009,2014-03-10 19:04:02 +0000,SimonCowell,Had a great weekend. On Saturday night I went to see a preview of I can't sing. It is very very funny. I loved it.
441060343645601792,2014-03-05 03:59:15 +0000,SimonCowell,More details at @icantsingUK
441059543049457664,2014-03-05 03:56:04 +0000,SimonCowell,And seriously expect the unexpected!
441059110444728320,2014-03-05 03:54:21 +0000,SimonCowell,It's difficult to describe because I have never seen anything like it before. I hope you love it as much as I do.
441058113861349376,2014-03-05 03:50:23 +0000,SimonCowell,Hello. Am very excited and relieved to confirm the first public preview for #ICantSingUk the X Factor musical is tonight.
440191537339592704,2014-03-02 18:26:55 +0000,SimonCowell,@terriseymour the most clumsy person on the planet!
440190961516556288,2014-03-02 18:24:38 +0000,SimonCowell,Terri arrived in Miami yesterday and within five minutes fell over and broke her arm. You can see the one arm interview on extra next week.
439939591437426688,2014-03-02 01:45:46 +0000,SimonCowell,Loving Miami. Eric is well and happy. Thank you for your messages.
439939198356029440,2014-03-02 01:44:13 +0000,SimonCowell,My dog is a zombie http://t.co/AnfS34985t
437295085311770625,2014-02-22 18:37:27 +0000,SimonCowell,7pm ITV.
437294894630326272,2014-02-22 18:36:42 +0000,SimonCowell,My buddies Ant and dec's Saturday Night Takeaway is back tonight. Love this show.
436707079097954304,2014-02-21 03:40:55 +0000,SimonCowell,It's seriously good. I can't wait for everyone to hear it.
436706518223060992,2014-02-21 03:38:42 +0000,SimonCowell,Am listening to the Alex and Sierra demos for their upcoming album. Fantastic.
436260312321646592,2014-02-19 22:05:38 +0000,SimonCowell,Thank you everyone for voting for best video. It is a brilliant video. Congrats to the boys and Ben who made it.
436249956685709312,2014-02-19 21:24:29 +0000,SimonCowell,A huge thank you to everyone who helped them achieve this. The greatest fans.
436246715499565056,2014-02-19 21:11:36 +0000,SimonCowell,Congratulations One D! Global success of the year. So happy for you.
435864544209272832,2014-02-18 19:52:59 +0000,SimonCowell,The best sweet shop in New York is Myzels. It's really old fashioned and sells the most amazing licorice. I have to get some now.
435612158031036416,2014-02-18 03:10:06 +0000,SimonCowell,@AnnaBmusicfan I they love him
435610705220616192,2014-02-18 03:04:20 +0000,SimonCowell,Eric's new friends http://t.co/nzjftpzEeW
435204569858330625,2014-02-17 00:10:29 +0000,SimonCowell,The last three days have been incredible. Eric Lauren sqiddly and diddly all happy.
435200770565500928,2014-02-16 23:55:24 +0000,SimonCowell,Squiddly and Diddly love New York. http://t.co/5eq2FZRsyE
435105977050755072,2014-02-16 17:38:43 +0000,SimonCowell,I never knew how much love and pride I would feel. http://t.co/bjwhJvrFBd
435105686700056577,2014-02-16 17:37:34 +0000,SimonCowell,â€¦. now you can see how very handsome little Eric is. http://t.co/cF5fhaFXqR
435105349100531712,2014-02-16 17:36:13 +0000,SimonCowell,"Mum, Dad and Eric. Now two days old. http://t.co/ChWlrXmtmO"
434486429495074816,2014-02-15 00:36:51 +0000,SimonCowell,Named after my dad
434485722650001408,2014-02-15 00:34:03 +0000,SimonCowell,Lauren in great shape. Thanks for all of your kind messages.
434484338584190976,2014-02-15 00:28:33 +0000,SimonCowell,Very happy to say Eric was born at 17.45pm. Healthy and handsome.
434149438870011904,2014-02-14 02:17:46 +0000,SimonCowell,Nicole will always be a part of the X factor family. Now signed to Sony as an artist. Thank you Nicole for everything.
434147688821825536,2014-02-14 02:10:49 +0000,SimonCowell,And I hope to share some very very exciting news with you next week.
434147156875018240,2014-02-14 02:08:42 +0000,SimonCowell,And of course good luck to my lil buddy Demi. A big supporter of acts on the show.
434146563255181312,2014-02-14 02:06:21 +0000,SimonCowell,Wishing little mix and fifth harmony good luck tonight in la. On tour with my buddy Demi.
434144542796038145,2014-02-14 01:58:19 +0000,SimonCowell,The Alex and Sierra early tracks are fantastic. I have huge faith in these two.
434144251421925376,2014-02-14 01:57:10 +0000,SimonCowell,And to anyone considering applying for X factor this year. Do it. We are taking this year very seriously. It's all about the talent
434143613413773312,2014-02-14 01:54:38 +0000,SimonCowell,We saw some brilliant acts today at the London britains got talent auditions. Very happy.
434143163272671232,2014-02-14 01:52:50 +0000,SimonCowell,And I have to thank the incredible fans reactions. Appreciate every message.
434142251066093568,2014-02-14 01:49:13 +0000,SimonCowell,Thought I should try and explain what really happened. Both fox and us made the decision to protect a very important brand to us.
434141834949173248,2014-02-14 01:47:34 +0000,SimonCowell,Sometimes we rest these shows in other countries. And that's what we did in a crowded market. In most cases the show returned stronger.
434141403963469824,2014-02-14 01:45:51 +0000,SimonCowell,The last time I appeared on X factor uk it resulted in over 45 million record sales. So I decided last year to return home to the uk show.
434140509758828544,2014-02-14 01:42:18 +0000,SimonCowell,"Not quite sure who ""offered"" X factor USA to a rival network. It wasn't my company. There will always be speculation about these things."
433982364709289984,2014-02-13 15:13:53 +0000,SimonCowell,Hi. Am with @Stephenmulhern at britains got talent.Has no followers on twitter. Can you help?
431979862858158080,2014-02-08 02:36:39 +0000,SimonCowell,We found some amazing talent. And now the search begins to find the next star. That's why we make these shows.
431978436018855937,2014-02-08 02:30:59 +0000,SimonCowell,I have had a blast. Really the best time of my life. Thank you for the support and the fun we have had together. It's never forgotten.
431977795670261760,2014-02-08 02:28:26 +0000,SimonCowell,You realise how much you owe to the fans who have supported all of the shows we made in both countries.
431977238280810496,2014-02-08 02:26:14 +0000,SimonCowell,Today was a day of mixed emotions. Excited to confirm me returning to the Uk X factor and sad to leave America.
431596343577313280,2014-02-07 01:12:41 +0000,SimonCowell,Some of my friends went to see the new Lego movie last night. All saying its genius.
430734076115709952,2014-02-04 16:06:21 +0000,SimonCowell,I just got back from bit auditions in Birmingham. Really good and really strange. Lowlight was a dancing owl. Who didn't.
430733594055954432,2014-02-04 16:04:26 +0000,SimonCowell,I have just been told that the new little mix album is number one on the us iTunes album chart. That is bloody fantastic. Congratulations
429631855705722881,2014-02-01 15:06:31 +0000,SimonCowell,Loved X Factor Italia. Now you'll be able to watch Got Talent on Sky. Have fun Italy!
429014857803776000,2014-01-30 22:14:47 +0000,SimonCowell,My friend Katie Piper has a new show on tonight. It's on channel 4 at ten pm. I heard it's really good.
428823853042003968,2014-01-30 09:35:48 +0000,SimonCowell,I was thinking on the flight how many great records there were last year. The music business feels exciting again. No rules.
428822645489270784,2014-01-30 09:31:00 +0000,SimonCowell,Apart from the smallest film library in the world everything else was great.
428822332082520064,2014-01-30 09:29:45 +0000,SimonCowell,I flew British airways. Went to watch a movie in their movie library section. You can choose from four movies. Almost too many.
428820635369086976,2014-01-30 09:23:01 +0000,SimonCowell,I just got back from New York to London. Had a great trip. And my dogs went crazy when I walked in the front door. A great feeling
428820010220679168,2014-01-30 09:20:32 +0000,SimonCowell,Or the Brits? It seems crazy they don't. Is there a reason?
428819222245150720,2014-01-30 09:17:24 +0000,SimonCowell,I have said it before and will say it again...the greatest group of fans. Why can't there be an award for the best fans at the Grammys
428818555292114944,2014-01-30 09:14:45 +0000,SimonCowell,And I also want to thank the other writers the producers the team at syco modest their management and sony worldwide. And.....
428817968928403456,2014-01-30 09:12:25 +0000,SimonCowell,So one direction were the biggest selling artists in 2013. I know how much they put into this record from start to finish. Very proud.
428816460040122368,2014-01-30 09:06:25 +0000,SimonCowell,1
427862222950658048,2014-01-27 17:54:37 +0000,SimonCowell,Good luck my lil pal Sinitta tonight on The Jump. Will be watching. X
427318129501667328,2014-01-26 05:52:35 +0000,SimonCowell,I went to see the most incredible show tonight in New York. It's called Beautiful. It's the Carole King story. Amazing!
426111249387380736,2014-01-22 21:56:53 +0000,SimonCowell,Sorry I meant nooooooooooooooooooooooooooooooooooo
426111110321016832,2014-01-22 21:56:20 +0000,SimonCowell,Nooooooooooooooooooooooooooooopppp
426110033055989760,2014-01-22 21:52:03 +0000,SimonCowell,Fingers crossed.
426108702580830210,2014-01-22 21:46:46 +0000,SimonCowell,It's ant and dec's night tonight. So well deserved. I really like you guys.
426098122247651328,2014-01-22 21:04:43 +0000,SimonCowell,Congrats ant ant dec. totally well deserved.
426089707106492416,2014-01-22 20:31:17 +0000,SimonCowell,I am fabulous. And so was Nigel. Very very funny.
425647570745327616,2014-01-21 15:14:23 +0000,SimonCowell,Hi. Am completely neutral but please vote for britains got talent for the national tv awards tomorrow. http://t.co/qx5JwEzZls
424664242084909056,2014-01-18 22:06:59 +0000,SimonCowell,http://t.co/GNlZKAavxs
424557210019328000,2014-01-18 15:01:41 +0000,SimonCowell,Where can I get a slice of toast?
424556276811845632,2014-01-18 14:57:58 +0000,SimonCowell,Hello. I am in Belfast. First day of britains got talent. Have just seen a cat backstage trying to play the guitar!
421545971932069888,2014-01-10 07:36:06 +0000,SimonCowell,Always be kind to kids and animals. Your mum is mostly right. And never dread Mondays. And most people younger than you know more than you.
421541582794682368,2014-01-10 07:18:39 +0000,SimonCowell,My new year resolutions. Advise not lecture. Listen more than you talk. Happiness is more fun than anger. Forgive and not fester.
421538082853486592,2014-01-10 07:04:45 +0000,SimonCowell,Feeling fit focused and happy.
421537564664029184,2014-01-10 07:02:41 +0000,SimonCowell,I read I will miss the launch of I Can't Sing the X factor musical in march. I will one hundred percent be there.
421536930892099584,2014-01-10 07:00:10 +0000,SimonCowell,I saw Wolf of Wall Street. Amazing film.
421536566876860416,2014-01-10 06:58:43 +0000,SimonCowell,Hello. Holiday nearly over. Feeling great. Back to the uk on the weekend.
418186606575886336,2014-01-01 01:07:11 +0000,SimonCowell,Happy new year. Be young. Be foolish. Be happy.
415569769216352256,2013-12-24 19:48:48 +0000,SimonCowell,Where can I get a mince pie in Barbados?
415569435668512768,2013-12-24 19:47:29 +0000,SimonCowell,Happy Xmas everyone.
413868659052777472,2013-12-20 03:09:12 +0000,SimonCowell,Thank. You. America.
413864362512637952,2013-12-20 02:52:07 +0000,SimonCowell,Minutes away from the decision - gulp
413864287375880192,2013-12-20 02:51:49 +0000,SimonCowell,Congrats @onedirection - It's a great record
413856881938296833,2013-12-20 02:22:24 +0000,SimonCowell,Leona incredible - Loved having you on the show
413605869020909568,2013-12-19 09:44:58 +0000,SimonCowell,And if you want to make yourself happy over Xmas watch wonderful life and elf. Both available on Apple TV.
413605313506316288,2013-12-19 09:42:45 +0000,SimonCowell,Next year on our shows the rules change. I had a light bulb moment two weeks ago.
413604501606522880,2013-12-19 09:39:32 +0000,SimonCowell,I don't know what is in the water this year but there have been so many incredible songs released this year. From all over world.
413601905865027585,2013-12-19 09:29:13 +0000,SimonCowell,Whenever a season ends you thank your lucky stars people watched and voted. And at the end of the day it's all about the talent.
413599203957276672,2013-12-19 09:18:29 +0000,SimonCowell,As to what happens in the new year. Stay posted.
413598895084564480,2013-12-19 09:17:15 +0000,SimonCowell,She and I have had our ups and downs but now consider her a true friend. The door will always be open. And thank you Demi. Simon.x
413598452040232960,2013-12-19 09:15:29 +0000,SimonCowell,To avoid speculation. Because of her tour next year it was unlikely she could do that and X factor.
413510225157582848,2013-12-19 03:24:54 +0000,SimonCowell,Hi. If you want to vote for Alex and Sierra here is their number...8558439301 or Text 1 to 21523
413505918270050305,2013-12-19 03:07:48 +0000,SimonCowell,"http://t.co/parxhTDeNF
I just had a nightmare that Alex and Sierra didn't win"
413504224387821568,2013-12-19 03:01:04 +0000,SimonCowell,Great show! No sleep tonight!
413501484441935872,2013-12-19 02:50:11 +0000,SimonCowell,I think the @AlexandSierra3 performance was stunning. Of course we need your votes. They would be unbelievable winners!
413495375412994048,2013-12-19 02:25:54 +0000,SimonCowell,Stay tuned for the best @AlexandSierra3  song
413495245557338112,2013-12-19 02:25:23 +0000,SimonCowell,Loved Iris - classic song
413493454988009472,2013-12-19 02:18:16 +0000,SimonCowell,. @leonalewismusic and @AlexandSierra3 were sensational!
413490896978444288,2013-12-19 02:08:06 +0000,SimonCowell,Thank you @PrinceRoyce for coming - you're such a star
413486719338426368,2013-12-19 01:51:30 +0000,SimonCowell,Jeff - his best performance of the season
413483176489541632,2013-12-19 01:37:26 +0000,SimonCowell,Alex and Sierra amazing but We need your votes!
413479672677031936,2013-12-19 01:23:30 +0000,SimonCowell,Carlito. Wants to win it!
413417032592289792,2013-12-18 21:14:36 +0000,SimonCowell,That should have read verry excited.
413416864111271936,2013-12-18 21:13:55 +0000,SimonCowell,Berry excited for tonight's final. I think the songs by Alex and Sierra are perfect. And their duet spectacular.
412897849513234434,2013-12-17 10:51:33 +0000,SimonCowell,And on that note coming from rehearsals this is shaping up to be a great final. There are three or four performances which are magic
412897210968195072,2013-12-17 10:49:01 +0000,SimonCowell,Sorry I meant squiddly
412896858390814720,2013-12-17 10:47:36 +0000,SimonCowell,I just had a nightmare Alex and Sierra didn't win X factor this week. Squid fly. http://t.co/parxhTDeNF
412525231459545088,2013-12-16 10:10:54 +0000,SimonCowell,Time for bed. Sorry for not following people for a while. Will remedy that next week.
412524233323868160,2013-12-16 10:06:56 +0000,SimonCowell,I would love to hear your top 5 songs this year.
412523995242561536,2013-12-16 10:05:59 +0000,SimonCowell,We had a music team  meeting earlier this week. And I realised how many amazing songs got released this year. The tide has turned.
412520469678403584,2013-12-16 09:51:58 +0000,SimonCowell,I watched a wonderful life this week. I think it's the best Xmas movie of all time.
412518164300181504,2013-12-16 09:42:49 +0000,SimonCowell,And next week it's the X factor USA final. You have no idea what goes on behind the scenes! It's going to be a great final. Watch and see.
412517421803528192,2013-12-16 09:39:52 +0000,SimonCowell,Thank you to the entire production team who worked on X factor uk. And of course the judges and the talent. And to everyone who watched.
412335652076670976,2013-12-15 21:37:34 +0000,SimonCowell,Congratulations Sam. We'll deserved. And I love your version of skyscraper. Happy Xmas. Simon.
411976621629771777,2013-12-14 21:50:55 +0000,SimonCowell,And Louis try to be interesting
411976427819397120,2013-12-14 21:50:09 +0000,SimonCowell,Good luck to Sam Nicholas and Luke. Wish I was there tonight.
411393210984849408,2013-12-13 07:12:39 +0000,SimonCowell,Very sad to lose my band restless road tonight. Great guys.
411263685349216256,2013-12-12 22:37:58 +0000,SimonCowell,"Also @leonalewismusic is very close to being number 1 in the UK. If you haven't heard, it's called One More Sleep. It's fantastic."
411262953296392192,2013-12-12 22:35:03 +0000,SimonCowell,Alex and Sierra are number 1 again on iTunes! Thanks to everyone who has bought it.
