ID,Posted at,Screen name,Text
576861682682707968,2015-03-14 21:45:17 +0000,SimonCowell,I just saw @playgoeswrong It is incredibly funny. And it was sold out.
576709115646332928,2015-03-14 11:39:02 +0000,SimonCowell,Today is the day guys in #PuertoRico! Registration for @labanda is open 8 to 10am at the Sheraton. Good Luck!#AudicionesLaBanda
576552997540524032,2015-03-14 01:18:41 +0000,SimonCowell,@RebelWilson Hello. You would be very welcome. But I have a feeling you don't need our show! I hope we get the chance to meet. Simon.X
576551191334772736,2015-03-14 01:11:30 +0000,SimonCowell,"RT @RebelWilson: @SimonCowell thanks Simon, if only I wasn't a professional actress I could audition for X Factor x"
576518859815006209,2015-03-13 23:03:02 +0000,SimonCowell,Now watching @comicrelief.. You have to hand it to these guys. Year after year they deliver.
576511661554724864,2015-03-13 22:34:25 +0000,SimonCowell,Diddly needs a haircut http://t.co/WF0Ve3bYzr
576509131860869120,2015-03-13 22:24:22 +0000,SimonCowell,"But really sad to see Robin Williams. Realise how much he is missed,"
576508837466886144,2015-03-13 22:23:12 +0000,SimonCowell,And Rebel Wilson is a total star.
576508256148959232,2015-03-13 22:20:53 +0000,SimonCowell,Watching Night Of The Museum 3. It's fantastic
576381579171377152,2015-03-13 13:57:31 +0000,SimonCowell,"Dermot good luck in your 24 hour dance challenge for Comic Relief. I've seen your dancing on X Factor, it'll be an endurance test for us all"
576152661877235712,2015-03-12 22:47:53 +0000,SimonCowell,How fantastic is the 3rd season of @HouseofCards with the brilliant @KevinSpacey. I am totally hooked. Make more soon.
576151765659287552,2015-03-12 22:44:19 +0000,SimonCowell,"Congratulations to @TerriSeymour and Clark on the birth of their baby girl. Lots of love from Me ,Lauren and lil Eric. X"
576134157174247424,2015-03-12 21:34:21 +0000,SimonCowell,Had a fantastic day at the Prince's Trust. Met some amazing people it was a very special day
574588081556316160,2015-03-08 15:10:48 +0000,SimonCowell,Hello
570686022398414848,2015-02-25 20:45:25 +0000,SimonCowell,You can all still vote for @Onedirection for Best Video at the Brits! Just tweet #ONEDIRECTIONBRIT to vote! Thank you
568591271419363329,2015-02-20 02:01:37 +0000,SimonCowell,I have been mega busy recently but excited about the year ahead. And cannot believe how quickly the year has gone...Eric is now one!
568590661643075584,2015-02-20 01:59:12 +0000,SimonCowell,And I wanted to say hello to everyone who follows me.
568590439911186432,2015-02-20 01:58:19 +0000,SimonCowell,We just finished Britains Got Talent auditions. Exhausting but I think brilliant this year. I love this show.
568575805409751040,2015-02-20 01:00:10 +0000,SimonCowell,".@ricky_martin Muy bien, I trust you. #RickyOnLaBanda #SoyLaBanda"
568574208931811328,2015-02-20 00:53:49 +0000,SimonCowell,"A Quien Quiera Escuchar, Ricky Martin will be joining @LaBanda as judge & executive producer. I for one am glad to hear it. #RickyOnLaBanda"
565525835961360384,2015-02-11 15:00:40 +0000,SimonCowell,Huge congrats @FifthHarmony on your top 3 album chart position. And of course a massive thank you to the fans.
563105396068712449,2015-02-04 22:42:43 +0000,SimonCowell,Diddly has just passed his driving test. http://t.co/NOtODWJ6ou
562776442275368960,2015-02-04 00:55:34 +0000,SimonCowell,Got to hand it you @Harmonizers. The @FifthHarmony album is currently number one on iTunes in 25 countries. LA is the man!
560620944977178625,2015-01-29 02:10:23 +0000,SimonCowell,Me complace anunciar que las audiciones para formar parte del nuevo boyband latino estÃ¡n abiertas. Â¡InscrÃ­bete ya! http://t.co/NahaE05tfP
560616584449126401,2015-01-29 01:53:04 +0000,SimonCowell,"RT @PerroneAngelika: @SimonCowell fromArgentina-Simon, I have a lot of monach-butterfly who love me.You have know why...its amazing!â˜…â˜…â˜…â˜…â˜… http://t.co/GRJbyo6dRR"
560615247393083392,2015-01-29 01:47:45 +0000,SimonCowell,Squiddly and Diddly have a new friend. Meet Freddy. http://t.co/182sPwPh8y
560613542215577601,2015-01-29 01:40:58 +0000,SimonCowell,On my way up to Manchester I went into a service station on the. Motorway. They have suddenly got bigger than airports .
560611611967492097,2015-01-29 01:33:18 +0000,SimonCowell,The show airs on Univision this September. This show could give someone the chance of a lifetime. And you know dreams really can come true!
560610928585367552,2015-01-29 01:30:35 +0000,SimonCowell,Auditions now open to be part of the ultimate Latino boyband. If you know someone who could be a star? Go here http://t.co/Tsm6MRXxOd
560610927360634880,2015-01-29 01:30:35 +0000,SimonCowell,Just arrived in Manchester for 3 days and tomorrow we start auditions up here. Fingers firmly crossed!
560608623412666368,2015-01-29 01:21:26 +0000,SimonCowell,A few lil tweets.......
560460308586958848,2015-01-28 15:32:05 +0000,SimonCowell,Belated Happy 50th Birthday to @TerriSeymour. X
558388345265348608,2015-01-22 22:18:50 +0000,SimonCowell,"Amy Watts, a lovely young woman I first met more than 10 years ago needs our support http://t.co/r74BeWgPOl #HoldAmysHand @Holdamyshand"
558023133337493504,2015-01-21 22:07:37 +0000,SimonCowell,Thank you to everyone who voted. We're thrilled!
557718319164583937,2015-01-21 01:56:23 +0000,SimonCowell,Good night. Or good morning.
557264028989259776,2015-01-19 19:51:12 +0000,SimonCowell,We are scared Britains Got Talent and the X Factor don't win at the @OfficialNTAs http://t.co/AnVKq99b00
557261242167881728,2015-01-19 19:40:08 +0000,SimonCowell,Feeling a bit nervous about my daddy @SimonCowell in case he doesn't win any awards at the @OfficialNTAs.. http://t.co/RPvfocgiCo
557259381054918656,2015-01-19 19:32:44 +0000,SimonCowell,Please vote for my daddy Simon at the @OfficialNTAs http://t.co/YnvXq5gvxx
557258551731970048,2015-01-19 19:29:26 +0000,SimonCowell,Guess who sent that last tweet!
557258366268211205,2015-01-19 19:28:42 +0000,SimonCowell,I am in love with @davidwalliams
557257543379353600,2015-01-19 19:25:26 +0000,SimonCowell,You know winning isn't important to me but if I do win I will rescue some kittens.
557257218039775233,2015-01-19 19:24:08 +0000,SimonCowell,RT @davidwalliams: With @SimonCowell in Edinburgh. He is a fantastic judge. Please vote for him @OfficialNTAs. I really don't deserve to be even nominated.
555943372435644417,2015-01-16 04:23:23 +0000,SimonCowell,Looks familiar? http://t.co/sw6nPTqFa8
551644981740331008,2015-01-04 07:43:07 +0000,SimonCowell,It's tough being so cute...Squiddly and Diddly after a long day on the beach. http://t.co/tw1PhlGsTn
551640542988468224,2015-01-04 07:25:29 +0000,SimonCowell,And thank you to everyone for your support and feedback last year. It is always appreciated. I think I have the best followers in the world.
551638546654953473,2015-01-04 07:17:33 +0000,SimonCowell,And my New Years Resolution is gyms are really boring and Family friends kids and animals make you happier..
551637372476329984,2015-01-04 07:12:53 +0000,SimonCowell,Happy New Year. Sorry it's a bit late. Wishing you great things this year.
549828604738015233,2014-12-30 07:25:29 +0000,SimonCowell,One little pup we met last night who needs a home http://t.co/cvhnHtz5hB
549826419078234112,2014-12-30 07:16:48 +0000,SimonCowell,Goodnight.
549822749687156736,2014-12-30 07:02:13 +0000,SimonCowell,Thank you to everyone who helped out at the dog charity last night. It will make a huge difference.
549281651952738304,2014-12-28 19:12:05 +0000,SimonCowell,Wii be at Holders House Holders Hill St James 7pm tonight. It's the annual fund raising for dogs in Barbados
549279036728295424,2014-12-28 19:01:42 +0000,SimonCowell,Me Squiddly and Diddly on holiday http://t.co/s3bLyASZwH
547450819634028544,2014-12-23 17:57:01 +0000,SimonCowell,My thoughts go out to the families who have suffered a huge loss in Glasgow this week. So sad.
546820086733242368,2014-12-22 00:10:42 +0000,SimonCowell,And so are Eric Squiddly and Diddly.
546819900715859968,2014-12-22 00:09:58 +0000,SimonCowell,Loving Barbados.
546819760475107328,2014-12-22 00:09:24 +0000,SimonCowell,Many congrats Ben on being number One.
545374870021095424,2014-12-18 00:27:56 +0000,SimonCowell,So sad to hear the news from Pakistan. Rest in peace.
544360405146271745,2014-12-15 05:16:48 +0000,SimonCowell,And now it's time to say goodnight to everyone. Or good morning.
544359280271720448,2014-12-15 05:12:20 +0000,SimonCowell,I want to say a huge thank you to every single person who worked on the show this year.
544358706784522240,2014-12-15 05:10:04 +0000,SimonCowell,We just got home. What a great night! So happy for @Bhaenow . Sad for @FleurEast. But what a final! I felt very proud tonight.
544233664230735874,2014-12-14 20:53:11 +0000,SimonCowell,Both Ben and Fleur were sensational. I have no idea what's going to happen
544167189553872896,2014-12-14 16:29:02 +0000,SimonCowell,And thank you to everyone who voted last night.
544167044451926018,2014-12-14 16:28:28 +0000,SimonCowell,Is it Ben or is it Fleur? Tonight we are going to find out.
543614722202152960,2014-12-13 03:53:44 +0000,SimonCowell,Goodnight everyone..
543614592988229632,2014-12-13 03:53:13 +0000,SimonCowell,And before I say goodnight a big thank you to was my eleventh million follower.
543613154228711424,2014-12-13 03:47:30 +0000,SimonCowell,And of course a huge thank you to everyone who has watched and voted. It's always appreciated.
543612595002175488,2014-12-13 03:45:17 +0000,SimonCowell,All of the rehearsals finished for X factor later tonight. This is going to be the closest final ever. Expect some spectacular performances.
542403849588187136,2014-12-09 19:42:09 +0000,SimonCowell,RT @onedirection: Incredible news! The guys have been named @billboard 's Top Artist of the Year for 2014! #1DTopBillboardArtist2014 http://t.co/fU4mKwKJpk
542391173680467968,2014-12-09 18:51:47 +0000,SimonCowell,I'm on my way down to the Whitgift shopping centre in Croydon to see Ben. Hopefully see you there!
541712237136977920,2014-12-07 21:53:56 +0000,SimonCowell,And I thought @SamBaileyREAL  really sang well tonight on the show.
541712061760548864,2014-12-07 21:53:14 +0000,SimonCowell,@FifthHarmony are currently number 9 on ITunes. I thought the girls were fantastic tonight.
541711680129216512,2014-12-07 21:51:43 +0000,SimonCowell,Thank you to all the #Harmonizers great news.
541706510569848832,2014-12-07 21:31:11 +0000,SimonCowell,"Great night tonight. Just heard some amazing news, Fleur East has just gone to number 1 on iTunes! http://t.co/NCw0WafL6b"
541691392914124800,2014-12-07 20:31:06 +0000,SimonCowell,Yes!!!!!!!!!!!!!!!!!!!
541367631685902337,2014-12-06 23:04:36 +0000,SimonCowell,Yes am excited for @FifthHarmony tomorrow.
541367357516808192,2014-12-06 23:03:30 +0000,SimonCowell,RT @5hfangurl: @SimonCowell SIMON are u exitied for fifth harmony tomorrow? Are they going to kill it??
541367112594620416,2014-12-06 23:02:32 +0000,SimonCowell,RT @PaulK1966: @SimonCowell @Bhaenow Was great but @FleurEast ? How good was that? We are witnessing the birth of a superstar in front of our eyes. Magic
541365065027690496,2014-12-06 22:54:24 +0000,SimonCowell,Yes it really was my mini. And I miss it.
541364913261015041,2014-12-06 22:53:48 +0000,SimonCowell,RT @flagg88: @SimonCowell Have you ever actually driven that mini?
541363679506485248,2014-12-06 22:48:53 +0000,SimonCowell,Loved @Bhaenow as well. I really hope they both make the final.
541362574319947776,2014-12-06 22:44:30 +0000,SimonCowell,If you missed @FleurEast on X Factor tonight try and watch her singing Uptown Funk. I think one of the best ever X Factor performances.
540552777546473472,2014-12-04 17:06:39 +0000,SimonCowell,"This weeks @XFactor_Italia contestants are performing their own original songs. Good luck with the ""inediti"" tonight guys! Ciao"
540333014472212480,2014-12-04 02:33:24 +0000,SimonCowell,RT @STOPANIMALABUS5: Dear @SimonCowell wondering if we could get a follow - we are a not-for-profit incorporation raising our paws for animals in need. :)
540332465660104704,2014-12-04 02:31:13 +0000,SimonCowell,I love it.
540332397586563072,2014-12-04 02:30:57 +0000,SimonCowell,RT @JosephbyNature: @SimonCowell Did you like the @FifthHarmony Christmas song? #5HAllIWantForChristmas
540331983751380993,2014-12-04 02:29:18 +0000,SimonCowell,I know I am not alone but how incredible is @serial. Compelling. I am hooked.
540320589479948288,2014-12-04 01:44:01 +0000,SimonCowell,Yes!
540318000487079936,2014-12-04 01:33:44 +0000,SimonCowell,RT @KevinSpacey: .@SimonCowell Why... did you miss me? Recognize any certain qualities? -F.U. @HouseofCards @DanaBrunetti
539600163820814336,2014-12-02 02:01:18 +0000,SimonCowell,Goodnight everyone.
539598684925992960,2014-12-02 01:55:26 +0000,SimonCowell,Interestingly feeling happy for someone else's success gives me this unusual warm feeling. I like this feeling. Is this normal?
539598248462528513,2014-12-02 01:53:42 +0000,SimonCowell,"Feb 27th is a very important day. It's the premiere of @HouseofCards  Season 3, On Netflix. Why I am so happy?"
538798750010191873,2014-11-29 20:56:47 +0000,SimonCowell,I thought Ben and fleur were amazing! But one more song still to come...big thanks to One Direction and Emeli for their song choices!
538740589211418624,2014-11-29 17:05:40 +0000,SimonCowell,Watching rehearsals for X Factor tonight. Could be Ben and Fleurs best week.
538145743660675072,2014-11-28 01:41:58 +0000,SimonCowell,I love It's A Wonderful Life.
538144649282867200,2014-11-28 01:37:37 +0000,SimonCowell,Back at home watching Elf. What's the best Xmas movie?
538144328359882753,2014-11-28 01:36:20 +0000,SimonCowell,Had an amazing night with @KatiePiper at her fundraising ball. An incredible person.
537783620757630976,2014-11-27 01:43:01 +0000,SimonCowell,Heard all the songs for this Saturday's @TheXFactor. 2 songs each this week and a few surprises. I expect some great performances.
537782471740620800,2014-11-27 01:38:27 +0000,SimonCowell,He literally ate all night long. And then asked if he could take some more food home with him.
537782049114193920,2014-11-27 01:36:46 +0000,SimonCowell,Had a great pre Thanksgiving dinner at my house tonight. Family and friends are everything. And Louis ate so much I think he will explode.
537442510382333952,2014-11-26 03:07:34 +0000,SimonCowell,Goodnight everyone.
537439662546358275,2014-11-26 02:56:15 +0000,SimonCowell,I keep reading me and @CherylOfficial have fallen out. We haven't. She has proven to be a great friend.
537439183221301248,2014-11-26 02:54:21 +0000,SimonCowell,Wishing @SusanBoyleHQ  great success with her new album out this week.
537438287406043137,2014-11-26 02:50:47 +0000,SimonCowell,Firstly congrats to @onedirection for what they won at the AMAS. Pretty amazing.
537437507382956033,2014-11-26 02:47:41 +0000,SimonCowell,Before I go to bed a few tweets...
536648292663574530,2014-11-23 22:31:38 +0000,SimonCowell,If you missed @Labrinthda1st on X Factor tonight try and watch it on catch up. It's an amazing performance of his new single Jealous.
536254035440173056,2014-11-22 20:24:59 +0000,SimonCowell,I loved Ben's performance and I'm glad that he takes risks!
535624906281844736,2014-11-21 02:45:03 +0000,SimonCowell,Goodnight.
535622857976729600,2014-11-21 02:36:55 +0000,SimonCowell,This is a time of the year when I always love my job.
535621078035759104,2014-11-21 02:29:51 +0000,SimonCowell,I am excited about this weekends @TheXFactor. Whitney vs Elton. I think there will be some special moments. Hopefully good ones!
535620345232101377,2014-11-21 02:26:56 +0000,SimonCowell,And it looks like it's going to do the same all over the world. Incredible.
535620077471932416,2014-11-21 02:25:52 +0000,SimonCowell,Amazing to see the generosity we have in this country when you see the @BandAid30 sales. The sales are huge.
535618794669244416,2014-11-21 02:20:46 +0000,SimonCowell,And @EllaHenderson has just gone top ten in the US with #Ghost. Her new single in the UK #Yours is stunning.
535618141448314880,2014-11-21 02:18:10 +0000,SimonCowell,The new @onedirection  album is getting great reviews. All credit to the boys. They have come a long way.
535617620469637121,2014-11-21 02:16:06 +0000,SimonCowell,Hello.
532386481139367936,2014-11-12 04:16:43 +0000,SimonCowell,Hello to my genius friend @NaughtyBoyMusic
532354865344045056,2014-11-12 02:11:05 +0000,SimonCowell,I think it's time for some follows...
532354781667278848,2014-11-12 02:10:45 +0000,SimonCowell,.@onedirection have just hired Eric as their new drummer https://t.co/vzZM20PIQ8
532354504248033281,2014-11-12 02:09:39 +0000,SimonCowell,Of course I will. X
532354368964935681,2014-11-12 02:09:06 +0000,SimonCowell,"RT @anita128: @SimonCowell pls pls spare Â£1 for Kent #rubylaura who has rare cancer, needs Â£500k ðŸ˜¥ https://t.co/ardFYGQLFn RT xx http://t.co/UKIiZDE1fr"
532349384760242177,2014-11-12 01:49:18 +0000,SimonCowell,They are a bit small!
532349271363026944,2014-11-12 01:48:51 +0000,SimonCowell,RT @larrysziall: @SimonCowell squiddly and diddly could be guide dogs
532348983042387968,2014-11-12 01:47:42 +0000,SimonCowell,Looking at excitement leading up to the @onedirection album next week. Once again the fans have showed their loyalty and support. Amazing!
532348159209787392,2014-11-12 01:44:26 +0000,SimonCowell,I went to meet some puppies training to be guide dogs. And a very special guy called Steve. His life has been transformed since getting one
532347124311003136,2014-11-12 01:40:19 +0000,SimonCowell,To all @FifthHarmony for news and info check out @mralihussainy..
531585868780548096,2014-11-09 23:15:22 +0000,SimonCowell,"I feel very bad for Paul tonight. A great singer and a great guy. Worth remembering Ella bounced back,"
531190958915072000,2014-11-08 21:06:08 +0000,SimonCowell,@THESTEVIRITCHIE will be remembered for that!
530911678943477760,2014-11-08 02:36:22 +0000,SimonCowell,RT @abelgarcia438: @SimonCowell help vote 4 @onedirection plz#EMABiggestFans1Dá… á… á…  #EMABiggestFans1Dá… á… á…  #EMABiggestFans1Dá… á… á…  #EMABiggestFans1Dá… á… á… 
530911553898684416,2014-11-08 02:35:52 +0000,SimonCowell,So Do I
530911450530086912,2014-11-08 02:35:28 +0000,SimonCowell,RT @XfactorUUsalove: @SimonCowell @FOXTV @TheXFactorUSA I wish you would see my tweets. AMERICA really misses #xfactorusa please come back this year. Please? :'(
530910417078730752,2014-11-08 02:31:21 +0000,SimonCowell,Interested to hear at this stage who you think should or could win this year.
530909660770234368,2014-11-08 02:28:21 +0000,SimonCowell,I had a great day at @TheXFactor Rehearsals. Two performances I think you will remember! But two people are really ill.
530908210379882496,2014-11-08 02:22:35 +0000,SimonCowell,Hello.
529654956723552256,2014-11-04 15:22:36 +0000,SimonCowell,@WayneRooney Aaaaaaaaaaaaaaaaaaaaaaaaaaaaaaaaaarrrrrrrrrrrrrrrrrrrgggggggggggggghhhhhhhhhhhhhhhh.
528744257348456449,2014-11-02 03:03:49 +0000,SimonCowell,"Tonight was my favourite X Factor show of the series. Thank you to the production, music and creative team."
528665181057212416,2014-11-01 21:49:35 +0000,SimonCowell,My favourite show of the series!
528643701573443584,2014-11-01 20:24:14 +0000,SimonCowell,By far @Bhaenow best performance so far!
528633334264774656,2014-11-01 19:43:03 +0000,SimonCowell,Get ready for fright night tonight on X Factor. And trust me there are some frights in store!
527471980745089026,2014-10-29 14:48:14 +0000,SimonCowell,Wow!
527471613802188801,2014-10-29 14:46:47 +0000,SimonCowell,And thank you to every Harmonizer who have stuck by the group. That's real loyalty.
527470734789332992,2014-10-29 14:43:17 +0000,SimonCowell,I have to hand it to @LA_Reid and Epic. They have worked really hard to make a fantastic record.
527470049041584130,2014-10-29 14:40:34 +0000,SimonCowell,We are working on it
527469883001688065,2014-10-29 14:39:54 +0000,SimonCowell,"RT @asslikecamz: @SimonCowell FIFTH HARMONY SHOULD GO PERFORM ""SLEDGEHAMMER"" ON THE X FACTOR UK!!! WHAT DO YOU THINK?? OMG #BuySledgeHammerOniTunes"
527467087611330560,2014-10-29 14:28:48 +0000,SimonCowell,We are
527467000650817536,2014-10-29 14:28:27 +0000,SimonCowell,RT @sassyjxuregui: @SimonCowell @FifthHarmony RELEASE IT IN THE UK
527466357785632768,2014-10-29 14:25:54 +0000,SimonCowell,La Reid just called me. @FifthHarmony are number 3 on iTunes with #Sledgehammer. You don't mess around Harmonizers.
526865579719028736,2014-10-27 22:38:37 +0000,SimonCowell,@mirrorjeffers all you can eat. Boom!
526864558871543808,2014-10-27 22:34:34 +0000,SimonCowell,Scampi and chips at the Harvester. Delicious.
526864333482237955,2014-10-27 22:33:40 +0000,SimonCowell,Thanks for dinner Stevi.
526477276771549184,2014-10-26 20:55:38 +0000,SimonCowell,"One Republic and Ed, simply amazing!"
526113360220553216,2014-10-25 20:49:34 +0000,SimonCowell,Congratulations to @StereoKicks - you're welcome to join my category any time
526108622003384320,2014-10-25 20:30:44 +0000,SimonCowell,And strangely I'm loving the new judge line up! http://t.co/zImtUBWm7N
526108130263183361,2014-10-25 20:28:47 +0000,SimonCowell,The overs are killing it tonight!!
526096423528697857,2014-10-25 19:42:16 +0000,SimonCowell,Somebody got out of bed the wrong side today!!
525653942395731970,2014-10-24 14:24:00 +0000,SimonCowell,Oops. @FifthHarmony #Sledgehammer
525653066717339649,2014-10-24 14:20:31 +0000,SimonCowell,@FifthHamony. #Sledgehammer.
523991985703878657,2014-10-20 00:19:59 +0000,SimonCowell,And thank you once again to all the @onedirection fans for your support once again.
523991347771224064,2014-10-20 00:17:27 +0000,SimonCowell,Congratulations to @EllaHenderson on your first album going to number one. I am very proud of you.
523926390769729536,2014-10-19 19:59:20 +0000,SimonCowell,Jessie J was sensational tonight!
523919573129916416,2014-10-19 19:32:14 +0000,SimonCowell,Feeling a little bit nervous now...
523584963653173248,2014-10-18 21:22:37 +0000,SimonCowell,I think Jay's performance was the best of the night!
523576466580467712,2014-10-18 20:48:51 +0000,SimonCowell,Mel's in a good mood tonight
523562605055852544,2014-10-18 19:53:47 +0000,SimonCowell,I really like 80s week! Ben was absolutely incredible
522440489036185600,2014-10-15 17:34:53 +0000,SimonCowell,Hello again. It's a big week for us because @EllaHenderson has her debut album out this week. It's an amazing album.
522439195386998784,2014-10-15 17:29:45 +0000,SimonCowell,Hello. The brilliant new @onedirection single Steal My Girl is out this week. Can we get it to number one?
521035432180867072,2014-10-11 20:31:42 +0000,SimonCowell,I thought Ben was sensational tonight!
521019904825499649,2014-10-11 19:30:00 +0000,SimonCowell,Loving the show. The best is still to come!
519264086258098176,2014-10-06 23:13:00 +0000,SimonCowell,RT @Sierrasfaces: @SimonCowell please tweet about Alex & Sierra's album and their new music video that came out today. Thank you.
519263324404727808,2014-10-06 23:09:58 +0000,SimonCowell,An amazing night at @PrideOfBritain tonight. A great leveller and met some amazing people. On tomorrow night on ITV.
518892330276098049,2014-10-05 22:35:46 +0000,SimonCowell,It's something we have been working on for a while.
518892117742321664,2014-10-05 22:34:56 +0000,SimonCowell,I hope to announce a project in the near future which will bring the issues of dolphins and whales in captivity to a mass audience.
518086841283915776,2014-10-03 17:15:03 +0000,SimonCowell,Like last week X Factor is on again tonight. The home visit shows start.
518086409157345280,2014-10-03 17:13:20 +0000,SimonCowell,"It's a great record and @Labrinthda1st, as I've already said, is a super talented guy"
518086406712074240,2014-10-03 17:13:19 +0000,SimonCowell,Hello.
517341111460065280,2014-10-01 15:51:47 +0000,SimonCowell,They are a hard working bunch who weren't aware of the growing concern regarding dolphins.
517340768961585152,2014-10-01 15:50:25 +0000,SimonCowell,I want to send this out regarding the Xtra Factor team.
517030735094759424,2014-09-30 19:18:27 +0000,SimonCowell,I think you all know my view on cruelty to animals so thank you all for your concern.
517030462074945536,2014-09-30 19:17:22 +0000,SimonCowell,Reading your tweets. I had no idea Xtra Factor producers filmed with dolphins. This will NOT be showed on Saturday.
516369702013378560,2014-09-28 23:31:45 +0000,SimonCowell,I am learning!
516369575051788290,2014-09-28 23:31:15 +0000,SimonCowell,@FifthHarmony are going to be huge this year. I can feel it.
516369137942417408,2014-09-28 23:29:30 +0000,SimonCowell,@LittleMix are working on a new album. We are totally committed to them. They have got better and better.
516367736537378816,2014-09-28 23:23:56 +0000,SimonCowell,@onedirection have delivered an amazing album and the new single Is getting an incredible reaction.
516366445840965632,2014-09-28 23:18:48 +0000,SimonCowell,I have just been lectured on how to tweet properly. So will try again!
516340266287247360,2014-09-28 21:34:47 +0000,SimonCowell,Like I always say the fans for all these bands should take the credit you deserve for your constant support.
516339646708862976,2014-09-28 21:32:19 +0000,SimonCowell,Fifth Harmony are going to be huge this year. I can feel it.
516339122169192448,2014-09-28 21:30:14 +0000,SimonCowell,Little Mix are working on a new album. We are totally committed to them. They have got better and better.
516338716298981377,2014-09-28 21:28:37 +0000,SimonCowell,One direction have delivered an amazing album and the new single is getting an incredible reaction.
516335835156066304,2014-09-28 21:17:10 +0000,SimonCowell,I just think there a number of groups this year I like.
516334765814079489,2014-09-28 21:12:55 +0000,SimonCowell,Er yes I do know that.
516334613967691777,2014-09-28 21:12:19 +0000,SimonCowell,"RT @itszayniefect: @SimonCowell the groups category was strong 2010, too simon"
