ID,Posted at,Screen name,Text
380484726600892416,2013-09-19 00:13:22 +0000,SimonCowell,I think Josh is a little star in the making
380476460240093184,2013-09-18 23:40:31 +0000,SimonCowell,Make sure you tune in to @TheXFactorUSA tonight & tomorrow at 8pm. I'll be checking twitter for your comments
378328667040264192,2013-09-13 01:25:57 +0000,SimonCowell,Just to be clear I was trying to sound like the guy who sang before me. It. Was. A. Joke.
378317906268147713,2013-09-13 00:43:12 +0000,SimonCowell,RT @sarah_ploof: Is it just me or is @SimonCowell sexy tonight?!
378317412401430528,2013-09-13 00:41:14 +0000,SimonCowell,@sarah_ploof yes!
378316898708234240,2013-09-13 00:39:12 +0000,SimonCowell,@mullingarlame worse
378316426287013889,2013-09-13 00:37:19 +0000,SimonCowell,I am just about to sing!
378308978062934016,2013-09-13 00:07:43 +0000,SimonCowell,X factor show 2 has just started on the east coast. I will be reading your comments.
378008407380590592,2013-09-12 04:13:22 +0000,SimonCowell,Thank you to everyone who watched the show tonight. And your comments. Tomorrows show is very very good.
377965859639410689,2013-09-12 01:24:17 +0000,SimonCowell,@gottabelovato I am reading them. And Simon is very happy.
377725459850870784,2013-09-11 09:29:02 +0000,SimonCowell,Going to bed. It's September 11th. My thoughts are with the families who lost someone special. They will never be forgotten.
377722596022042624,2013-09-11 09:17:39 +0000,SimonCowell,@terri_kao_67896 fox
377720163296362496,2013-09-11 09:07:59 +0000,SimonCowell,@LauraxTomlinson  yes I will. X
377715223308013568,2013-09-11 08:48:21 +0000,SimonCowell,The second show goes out Thursday. Thank you to everyone who watches. I will be reading your comments. Sleep well. Simon.
377714151294238720,2013-09-11 08:44:05 +0000,SimonCowell,Hello. The X factor USA starts tonight on fox. It's better. Funnier. And some of the contestants tonight are very special. Hope you like it.
375068367180541952,2013-09-04 01:30:41 +0000,SimonCowell,I am going to get two dogs when I get back. Probably cairn terriers. If any rescue shelters have some who need a home let me know.
375067382538309632,2013-09-04 01:26:47 +0000,SimonCowell,Who is incredible.
375066844337799168,2013-09-04 01:24:38 +0000,SimonCowell,On my way back to la. Drinking a very delicious vodka lime and soda and watching X factor USA. There is a singer in the first show
374924210852089856,2013-09-03 15:57:52 +0000,SimonCowell,This new @CherLloyd single is fantastic https://t.co/hNrx7cSaEF
374617577290731520,2013-09-02 19:39:25 +0000,SimonCowell,"Very excited to attend the press launch of The X Factor musical @icantsingUK today, as usual I got it completely in the neck! But I love it"
374155975173079040,2013-09-01 13:05:10 +0000,SimonCowell,On my way to my mums for Sunday lunch. The best roast potatoes in the world.
374155759774605312,2013-09-01 13:04:19 +0000,SimonCowell,Well done the uk X factor production team and judges. Great show and great numbers. Tonight's show has a very very special performance
373826060062060544,2013-08-31 15:14:12 +0000,SimonCowell,Thank you to everyone who bought a ticket to the one d movie. It's doing great.
373825471815098368,2013-08-31 15:11:52 +0000,SimonCowell,X factor back tonight. It's very funny. We may have the biggest X factor plonker. Phil spelt with an F. Plus a future star.
372725704888446976,2013-08-28 14:21:47 +0000,SimonCowell,Huge congrats to Richard and Adam. Looks like the eggs didn't work.
372046312092745728,2013-08-26 17:22:07 +0000,SimonCowell,Congratulations @onedirection for your VMA. What a brilliant week for you guys! Very proud of you.
370210934759116800,2013-08-21 15:48:59 +0000,SimonCowell,Hello
362428979774361600,2013-07-31 04:26:17 +0000,SimonCowell,Congratulations @Emblemthree Really proud of you all. A great album out this week https://t.co/OCjiR0s7QN
361673571581427712,2013-07-29 02:24:33 +0000,SimonCowell,Congrats jahmene. Amazing.
359808506691469314,2013-07-23 22:53:27 +0000,SimonCowell,Is best song ever the best song ever?
359808114318508032,2013-07-23 22:51:54 +0000,SimonCowell,And tomorrow night on the results show Labrinth is performing. If you haven't heard his new single in America it is amazing.
359807607457849351,2013-07-23 22:49:53 +0000,SimonCowell,So Americas got talent is moving to radio city music hall. And the live shows start tonight.
357677718839635968,2013-07-18 01:46:28 +0000,SimonCowell,"RT @todayshow: Reminder, tomorrow on the plaza @FifthHarmony will preform! Let us know you're coming using #HarmonizeTODAY! http://t.co/kw2Ue6F9mQ"
357677467470790656,2013-07-18 01:45:28 +0000,SimonCowell,Good luck girls @FifthHarmony
355454621814231040,2013-07-11 22:32:40 +0000,SimonCowell,"Don't miss @GotTalent stars Attraction, Jack Carroll & Gabz @MayorofLondon Olympic Legacy event Go Local 19 July  http://t.co/5m6RjLydz4"
355127824409051136,2013-07-11 00:54:05 +0000,SimonCowell,Auditions today Los Angeles. Verrrryyyy good.
354113150095867904,2013-07-08 05:42:08 +0000,SimonCowell,I was lucky to meet David once. I asked him for one bit of advice. He told me always know when to leave the fair. Great advice.
354112769450184704,2013-07-08 05:40:37 +0000,SimonCowell,Watching Inventing David Geffen on Apple TV. For anyone who wants to see what it takes to succeed. Watch this movie. A genius.
353976958389989378,2013-07-07 20:40:58 +0000,SimonCowell,Congrats Andy. Had a bet you would win. Amazing result.
353976636321972225,2013-07-07 20:39:41 +0000,SimonCowell,Congrats Andy. Had a bet
353328822608863233,2013-07-06 01:45:30 +0000,SimonCowell,Missed the fifth harmony girls. They are sounding amazing.
353328653909782528,2013-07-06 01:44:50 +0000,SimonCowell,Me and My Girls @FifthHarmony http://t.co/sNHnKfezrX
352939230575603712,2013-07-04 23:57:24 +0000,SimonCowell,"Big day for @Xfactor_RTL tomorrow. The grand finale. Best of luck @harismusic95, @adriaanpersons & @bbraveofficial"
352576213711192065,2013-07-03 23:54:54 +0000,SimonCowell,And when I land in la straight to the dentists. Gulp
352575799808888833,2013-07-03 23:53:15 +0000,SimonCowell,Currently flying over Arizona. Drinking a delicious cup of tea.
352517177485697026,2013-07-03 20:00:19 +0000,SimonCowell,Denver was great. Auditions...fantastic. Strange. Weird. But overall we had a great time and found some potential stars.
352516667726757889,2013-07-03 19:58:17 +0000,SimonCowell,Gabz. Lighters. If you haven't heard this it is fantastic!
351633714331127809,2013-07-01 09:29:45 +0000,SimonCowell,@LewisCorreia1 you don't. Others do. Be happy. X
351633387162845184,2013-07-01 09:28:27 +0000,SimonCowell,@benwinston they had a great director. That goes without saying.
351624278749360128,2013-07-01 08:52:15 +0000,SimonCowell,And I didn't snub Cheryl's party. I just couldn't go because of my filming dates. We are close friends again and I adore her.
351623814146310144,2013-07-01 08:50:24 +0000,SimonCowell,If you haven't heard Chloe by emblem3. You should. It's slooooowly rising the charts. The more I hear it the more I like it.
351623171776069632,2013-07-01 08:47:51 +0000,SimonCowell,"Some things are more important than the music""business"" or the tv ""business"". And today I learnt that."
351622616966111233,2013-07-01 08:45:39 +0000,SimonCowell,"Someone I work closely with today taught me the importance of friendship, trust and loyalty. This person is a very special person."
351622025363730432,2013-07-01 08:43:18 +0000,SimonCowell,The rough cut of the fifth harmony video came in today for miss movin on. I love it.
351621468246913027,2013-07-01 08:41:05 +0000,SimonCowell,Denver auditions started today. Some great. Some truly awful. Two more days to go. Two people today were outstanding.
351620530186620930,2013-07-01 08:37:21 +0000,SimonCowell,"Hi. A lot has happened in two days... The new one d video for best song ever is their best video ever, these boys are very very smart."
351430976863350785,2013-06-30 20:04:08 +0000,SimonCowell,Just arrived in Denver. No sign of the other girls.
351087291701272576,2013-06-29 21:18:27 +0000,SimonCowell,Good luck to the finalists of @xfactornz! Have a fantastic night @WPatuwai @moorhousemusic @jackiesian @Gap5_official @CassHenderson14
349891497598001153,2013-06-26 14:06:48 +0000,SimonCowell,Had a very nice evening at my friend Carl's birthday last night. Elton John performed. He sounded amazing.
348712711019966464,2013-06-23 08:02:43 +0000,SimonCowell,My thoughts are with you Demi. X
348592781394051072,2013-06-23 00:06:10 +0000,SimonCowell,Just did an interview with @kilmeade @FoxandFriends Very interesting! Goes out Monday between 6 & 9 ET. No shirts!
347817782123040769,2013-06-20 20:46:36 +0000,SimonCowell,Congrats on @KELLYROWLAND's album out now - I've heard it and it's amazing
347435614951596035,2013-06-19 19:28:00 +0000,SimonCowell,"Happy Birthday @PaulaAbdul. Lots of love, miss you, Simon"
346897875575373825,2013-06-18 07:51:13 +0000,SimonCowell,@pottypony hi hope you are feeling better. Simon
346896920893071360,2013-06-18 07:47:25 +0000,SimonCowell,@KelseyMcCauleyy for jet lag?
346895367289315328,2013-06-18 07:41:15 +0000,SimonCowell,Last week. London. New Orleans. Los Angeles. New York. Long Island. Then New York. London. Denver Los Angeles. What is a good jet lag cure?
346894759605968896,2013-06-18 07:38:50 +0000,SimonCowell,Some of the auditions in New Orleans were just great. Some were horrendous. But we had a great time.
346893824838213632,2013-06-18 07:35:07 +0000,SimonCowell,Long Island this week. Starts Wednesday. Can't wait.
346790228150857728,2013-06-18 00:43:28 +0000,SimonCowell,"Happy 50th @paurubio, lots of love, Simon"
345109471250509824,2013-06-13 09:24:44 +0000,SimonCowell,A weird five days. Started with eggs on bgt. Flew to New Orleans. Filmed auditions and on the second day a guy performed in a chicken suit.
345108397076656128,2013-06-13 09:20:28 +0000,SimonCowell,I watched an early cut of the one direction film tonight on the plane back to Los Angeles. This is going to be a great movie.
345107590327435264,2013-06-13 09:17:15 +0000,SimonCowell,And I love it. A very different show this year. I'd does feel time for a change.
345107159119454208,2013-06-13 09:15:33 +0000,SimonCowell,I thought X factor would be fun this year with me and three girls on the panel. Be careful what you wish for! It's different!
345106598047395840,2013-06-13 09:13:19 +0000,SimonCowell,Two days in New Orleans. Started slow and then the talent showed up. A great city with great people.
345106265984335872,2013-06-13 09:12:00 +0000,SimonCowell,Demi. Stopppppppppppppppppp please with the horrific pictures. They are giving me nightmares.
345105955207401472,2013-06-13 09:10:46 +0000,SimonCowell,Nigel lythgoe and kenny Warwick leaving idol? We started off together. A few ok times and lot of great times. Thank you for everything.
344911976721428481,2013-06-12 20:19:58 +0000,SimonCowell,Someone is going to be happy sitting next to me today.
344496137098641408,2013-06-11 16:47:34 +0000,SimonCowell,Ready for the auditions to start in New Orleans?
343739608145727488,2013-06-09 14:41:23 +0000,SimonCowell,@johnprescott. That was funny.
343739067684499456,2013-06-09 14:39:14 +0000,SimonCowell,I don't think eggs should be allowed on talent shows. Discuss?
343500915308908544,2013-06-08 22:52:54 +0000,SimonCowell,Bloody hell! Just watched the Adam and Richard performance back. They didn't miss a note.
343495766498758656,2013-06-08 22:32:27 +0000,SimonCowell,I loved the show tonight. Great winners and a future star the runner up. Thanks to everyone who has watched the show.
343495295520370688,2013-06-08 22:30:34 +0000,SimonCowell,I really don't like eggs.
343104220444102656,2013-06-07 20:36:35 +0000,SimonCowell,"The @EmblemThree  album (which is fantastic!) is coming out in America soon. Click here to preorder it http://t.co/C48vVuVvXN. Best, Simon"
343088278322425856,2013-06-07 19:33:14 +0000,SimonCowell,I drove one of the best cars in the world this week. It's a super light caterham 7. Unbelievable. Have ordered one for America.
343086349777264641,2013-06-07 19:25:34 +0000,SimonCowell,@SallyFinestone I hate eggs
343086090758017025,2013-06-07 19:24:32 +0000,SimonCowell,Ha ha. Meant going home.
343085938513174529,2013-06-07 19:23:56 +0000,SimonCowell,And if I am very lucky butterscotch angel delight for pudding.
343085508978679808,2013-06-07 19:22:14 +0000,SimonCowell,"Gong home to eat fish and chips,a gherkin and bread and butter. Very happy."
343063613617078273,2013-06-07 17:55:13 +0000,SimonCowell,Miss moving on. And it is fantastic!
343063203074408449,2013-06-07 17:53:36 +0000,SimonCowell,Very funny night with Louis Walsh last night. Lou lous is my favourite restaurant now.
343062834952945665,2013-06-07 17:52:08 +0000,SimonCowell,And the first fifth harmony single is.........
343062727343865856,2013-06-07 17:51:42 +0000,SimonCowell,At rehearsals. Tomorrows final is going to be fantastic.
343062558246318080,2013-06-07 17:51:02 +0000,SimonCowell,Sorry. That was a misspell
343062104150003712,2013-06-07 17:49:14 +0000,SimonCowell,Brittantella
342317124250923008,2013-06-05 16:28:57 +0000,SimonCowell,@directiovatic28 a million percent yes
342291256216522753,2013-06-05 14:46:09 +0000,SimonCowell,Loved Americas got talent last night. Panel great and nick a total star.
342291028956545024,2013-06-05 14:45:15 +0000,SimonCowell,Congratulations little mix. Very proud of you. X
342070465231192064,2013-06-05 00:08:48 +0000,SimonCowell,Time for bed. Goodnight.
342069009665101824,2013-06-05 00:03:01 +0000,SimonCowell,@waltzer_boy I don't have a twitter guy or twitter girl. This is Simon.
342067774128009216,2013-06-04 23:58:07 +0000,SimonCowell,@harmonugger yeeeeeeeeeeeeeeeeesssswsssssss
342066666865311745,2013-06-04 23:53:43 +0000,SimonCowell,Dear fifth harmony. Please. Announce. The. Single. Release. Date. And. The. Name. Of. The Song. This. Week. Thank you. Simon. X
342046492137238528,2013-06-04 22:33:33 +0000,SimonCowell,Wild card has been chosen for next weeks bgt final. I think it will be a popular choice. David chose a dog act. He is a bit tired.
341222421002588160,2013-06-02 15:58:59 +0000,SimonCowell,Sorry Katherine. X
341222369706246144,2013-06-02 15:58:47 +0000,SimonCowell,I have to admit Demi is a fantastic singer.
341222072808243200,2013-06-02 15:57:36 +0000,SimonCowell,It was a great week. Looking forward to next Saturday. Thanks to everyone who watched.
340152972862435330,2013-05-30 17:09:23 +0000,SimonCowell,Good luck to the Dutch X factor finalists  @harismusic95 @astridtan @brownhillmusic
340152385697611777,2013-05-30 17:07:03 +0000,SimonCowell,Good luck to the Dutch X Factor finalists @xfactor_rtl @bbraveofficial @weareorpheus @adriaanpersons @clarissanadine @milouvanegmond
339530876054552576,2013-05-28 23:57:23 +0000,SimonCowell,So proud of @LittleMixOffic! The first group to win @TheXFactor UK have released their debut album #DNA in the US http://t.co/y9K7T2xm55
339521847479648256,2013-05-28 23:21:31 +0000,SimonCowell,RT @missingpeople: We're pleased to announce that Sanita Muceniece has returned safe and well. Many thanks to anyone who tweeted her appeal #BigTweet
339519250865729538,2013-05-28 23:11:12 +0000,SimonCowell,@HolmeJanet @justsimoncowell no I don't blame you. X
339517616156725250,2013-05-28 23:04:42 +0000,SimonCowell,@amelia1390 well spotted.
339517347633168384,2013-05-28 23:03:38 +0000,SimonCowell,Oops I meant j lo.
339510679440601089,2013-05-28 22:37:08 +0000,SimonCowell,Jo lo incredible on the show tonight. A total superstar.
339510286228787200,2013-05-28 22:35:34 +0000,SimonCowell,I can't get gabz song the one out of my head.
339509837807382528,2013-05-28 22:33:47 +0000,SimonCowell,Loving britains got talent this year. Congrats to jack and gabz tonight.
339171942160556032,2013-05-28 00:11:07 +0000,SimonCowell,Good night everyone.
339166810635124736,2013-05-27 23:50:43 +0000,SimonCowell,I did think Lewis was very cool this week no excuses. Took it on the chin. Class.
339166348884205568,2013-05-27 23:48:53 +0000,SimonCowell,@NootWood yes. Agreed.
339165808964022272,2013-05-27 23:46:44 +0000,SimonCowell,And then worst of all the noise Sebastian Vettel makes when he wins. I still think it's the greatest sport in the world.
339164802612092928,2013-05-27 23:42:44 +0000,SimonCowell,Have you noticed a lot of whining from the drivers this year. He is too close. He wouldn't let me overtake him. He overtook me. Etc.
339163390654160896,2013-05-27 23:37:08 +0000,SimonCowell,Loved the Monaco Grand Prix this weekend. A couple of things are a bit annoying
339162675630202880,2013-05-27 23:34:17 +0000,SimonCowell,I really do like working on bgt. It is a little crazy and then you sometimes find these gems. Tonight had its moments!
339160881176915968,2013-05-27 23:27:10 +0000,SimonCowell,Success doesn't create a monster.It enables them to become a monster.
339079847240425472,2013-05-27 18:05:10 +0000,SimonCowell,Show starts in half an hour. Just watched dress rehearsals!!! #BGT
338433761769295873,2013-05-25 23:17:51 +0000,SimonCowell,Rt â€œ@missingpeople: Many thanks to Everyone for an amazing effort to find missing children during the #BigTweet for Missing Childrenâ€
338422643038507008,2013-05-25 22:33:40 +0000,SimonCowell,RT â€œ@missingpeople: Mariam has been missing since 2006.  Please RT and help us find her http://t.co/KR6ztnHtrm #BigTweetâ€
338414559243157504,2013-05-25 22:01:33 +0000,SimonCowell,RT @missingpeople: Ayuub has been missing since 13 March.  Please RT and help us find him http://t.co/neYKyNe4Cf #BigTweet
338407767981309952,2013-05-25 21:34:33 +0000,SimonCowell,RT @missingpeople: Nadra went missing in January last year.  Please RT and help us find her. http://t.co/5cx6b0pSwe #BigTweet
338400560707420160,2013-05-25 21:05:55 +0000,SimonCowell,RT â€œ@missingpeople: Jasmine has been missing since May - Please RT to help us find her http://t.co/ZIKwyI2aPJ #BigTweetâ€
338391874702278657,2013-05-25 20:31:24 +0000,SimonCowell,RT @missingpeople: Quan went missing in June. Please RT and help us find him http://t.co/EnBoy4u8Ka #BigTweet
338384683987529728,2013-05-25 20:02:50 +0000,SimonCowell,RT â€œ@missingpeople: Huu son has been missing since April 2012.  Please RT and help us find him http://t.co/Iec2vRy0c9  #BigTweetâ€
338371529593200640,2013-05-25 19:10:33 +0000,SimonCowell,RT â€œ@missingpeople: Kadia has been missing since October.  Please RT and help us find her http://t.co/w9HOffI6IB #BigTweetâ€
338363702740910080,2013-05-25 18:39:27 +0000,SimonCowell,RT @missingpeople: Hund-van has been missing since June. Can you help? Please RT http://t.co/qnnbbZiinx #BigTweet
338358211889479680,2013-05-25 18:17:38 +0000,SimonCowell,RT @missingpeople: Andrew went missing in 2007. Please RT and help us search for him http://t.co/w8p1Z0cxwv #BigTweet
338342045259296769,2013-05-25 17:13:24 +0000,SimonCowell,RT â€œ@missingpeople: Shalini has been missing since April - please RT and help us find her http://t.co/p7kqXqfZI8 #BigTweetâ€
338337862355402752,2013-05-25 16:56:47 +0000,SimonCowell,RT @missingpeople: Trang has been missing since 2006. Please RT and help us find her http://t.co/8O6EoBLtPm #BigTweet
338315152858419200,2013-05-25 15:26:32 +0000,SimonCowell,RT â€œ@missingpeople: Madeleine went missing in 2007.  Please RT and help us find her http://t.co/YVsz1WXsQg #BigTweetâ€
338304077865828352,2013-05-25 14:42:32 +0000,SimonCowell,RT â€œ@missingpeople: Jamie has been missing since 1993. Please RT and help us find her http://t.co/IeMXJArQ5U #BigTweetâ€
338296244545921025,2013-05-25 14:11:24 +0000,SimonCowell,RT @missingpeople: Tien went missing on 10 April. Please RT and help us find him http://t.co/LLapBw3Oy4 #BigTweet
338286735538659328,2013-05-25 13:33:37 +0000,SimonCowell,RT â€œ@missingpeople: Duc has been missing since June. Please RT and help us find him http://t.co/ivAFrFtTSL #BigTweetâ€
338279149754007554,2013-05-25 13:03:28 +0000,SimonCowell,RT â€œ@missingpeople: Sandy went missing in 1976.  Please RT and help us find him http://t.co/kg8uYTGlaZ #BigTweetâ€
338271213476524032,2013-05-25 12:31:56 +0000,SimonCowell,RT @missingpeople: Anh has been missing since 2011. Please RT and help us find her http://t.co/yLzKyxNpZb #BigTweet
338256230885765120,2013-05-25 11:32:24 +0000,SimonCowell,RT @missingpeople: Akram has been missing since 2007. Please RT to help us find him http://t.co/LM44QFAOSH #BigTweet
338249409882103808,2013-05-25 11:05:18 +0000,SimonCowell,RT â€œ@missingpeople: Abdullah has been missing since August. Please RT and help us find him http://t.co/A7SaYSiqNM #BigTweetâ€
338241572892205057,2013-05-25 10:34:09 +0000,SimonCowell,RT â€œ@missingpeople: Sarah has been missing since 2000 and we need your help. Please RT to help find her http://t.co/qCZxBy8xVw #BigTweetâ€
338234136584142848,2013-05-25 10:04:36 +0000,SimonCowell,RT @missingpeople: Katrice has been missing since 1981 - please RT and help us find her http://t.co/Vk8CDpHcse #BigTweet
338225732339777536,2013-05-25 09:31:13 +0000,SimonCowell,RT @missingpeople: Lam has been missing since August 2011.  Please help us and RT his appeal http://t.co/tMsLq4He3R #BigTweet
338220064593555456,2013-05-25 09:08:41 +0000,SimonCowell,RT â€œ@missingpeople: Nan has been missing since Feb 2012.  Please RT and help us find him http://t.co/ZMLr1cYG3a #BigTweetâ€
338211231729074177,2013-05-25 08:33:35 +0000,SimonCowell,RT â€œ@missingpeople: Yousef has been missing since 2010.  Please RT and help us and search for him http://t.co/tZo6cYVdNU #BigTweetâ€
338204431961178112,2013-05-25 08:06:34 +0000,SimonCowell,RT @missingpeople: Vo has been missing since January.  Please RT and help us find him http://t.co/Wu9tpazA5b #BigTweet
338198110222303235,2013-05-25 07:41:27 +0000,SimonCowell,RT @missingpeople: Joseph went missing in 2007.  Please RT and help us find him http://t.co/Pc7vYWoffQ #BigTweet
338195603945295872,2013-05-25 07:31:30 +0000,SimonCowell,RT â€œ@missingpeople: Martin has been missing since 1979. Please RT and help us find him. http://t.co/PDWOFmfDMW #BigTweetâ€
338189549844971520,2013-05-25 07:07:26 +0000,SimonCowell,RT @missingpeople: Ben went missing in 1991 - please RT and help us find him http://t.co/RxGXKK0lCm #BigTweet
338180884496781312,2013-05-25 06:33:00 +0000,SimonCowell,RT @missingpeople: Lee has been missing since 1988. Please RT and help us find him http://t.co/ubVMRPVf9T #BigTweet
338172868514951168,2013-05-25 06:01:09 +0000,SimonCowell,RT â€œ@missingpeople: Klajdi has been missing since April. Please RT and help us find him http://t.co/gJWRoFqD0F #BigTweetâ€
338165800114454528,2013-05-25 05:33:04 +0000,SimonCowell,RT â€œ@missingpeople: Kevin went missing in 1986.  Please RT and help us search for him http://t.co/y7Zybu2wGv #BigTweetâ€
338163161502990336,2013-05-25 05:22:35 +0000,SimonCowell,RT @missingpeople: Our friends @MissingChildEU are working hard to bring children home - take a look #BigTweet http://t.co/l26L0i2EaO
338157771931398144,2013-05-25 05:01:10 +0000,SimonCowell,RT â€œ@missingpeople: Joseph went missing in 2007.  Please RT and help us find him http://t.co/FpiFKCx9Tt #BigTweetâ€
338151871615205376,2013-05-25 04:37:43 +0000,SimonCowell,RT @missingpeople: Damien has been missing since 1996.  Please RT and help us find him http://t.co/0Ysd0OEdge #BigTweet
338150177053474816,2013-05-25 04:30:59 +0000,SimonCowell,"RT â€œ@missingpeople: Jean-louis has been missing since 2011. Please help us find him, RT http://t.co/QRpGaKQu8O #BigTweetâ€"
338144321171771393,2013-05-25 04:07:43 +0000,SimonCowell,RT â€œ@missingpeople: Iasmin has been missing since 2009. Please RT and help us search http://t.co/s2eidNtsOA #BigTweetâ€
338137368932528128,2013-05-25 03:40:05 +0000,SimonCowell,"RT @missingpeople: Please RT and help us find Alexander, who has been missing since 2008 http://t.co/Y46Wo3mwRm #BigTweet"
338127718434611200,2013-05-25 03:01:44 +0000,SimonCowell,RT @missingpeople: Yan has been missing since 2006 and we need your help. Please RT her appeal http://t.co/7oYkd8mDek #BigTweet
338120078396637184,2013-05-25 02:31:23 +0000,SimonCowell,RT @missingpeople: Tam has been missing since 2010.  Please help us and RT his appeal http://t.co/e6wmGA4NLq #BigTweet
338112417294860289,2013-05-25 02:00:56 +0000,SimonCowell,RT @missingpeople: Suhaib went missing in 2010. Please help us search and RT http://t.co/dcxmivMjyN #BigTweet
338104885503475713,2013-05-25 01:31:01 +0000,SimonCowell,RT @missingpeople: Ruth went missing in 1995.  Please RT and help us find her http://t.co/wbI6kKD9Cm #BigTweet
338101635576377344,2013-05-25 01:18:06 +0000,SimonCowell,It's time for bed. Am a bit jet lagged. Good night. Good morning. X
338098218510458880,2013-05-25 01:04:31 +0000,SimonCowell,RT @missingpeople: Lingshan went missing in 2006. Please RT and help us find him http://t.co/j25UCOgvQW #BigTweet
338095953917657089,2013-05-25 00:55:31 +0000,SimonCowell,@dinahknowles coming soon.
338094085304889345,2013-05-25 00:48:06 +0000,SimonCowell,We saw some fantastic people. And not so fantastic! But one audition was truly one of the best I have ever witnessed. This one is special.
338093408050614273,2013-05-25 00:45:24 +0000,SimonCowell,Charleston was a fantastic two days. We started our usa auditions there last week. Love the region and the people.
338092891522093057,2013-05-25 00:43:21 +0000,SimonCowell,Thank you already for the response to the missing people campaign. I like the people who follow me. Well most of them.
338092190796492800,2013-05-25 00:40:34 +0000,SimonCowell,@MimisLilLambUK I was thinking that maybe I could work to find the right artist to represent us. If they would let me.
338091694807449600,2013-05-25 00:38:36 +0000,SimonCowell,Back in London now. Preparing myself for the britains got talent live shows. Have no idea what to expect. But that's the fun of live tv.
